-- phpMyAdmin SQL Dump
-- version 4.9.5
-- https://www.phpmyadmin.net/
--
-- Host: localhost:3306
-- Waktu pembuatan: 15 Jan 2021 pada 21.20
-- Versi server: 5.7.31-log-cll-lve
-- Versi PHP: 7.3.6

SET SQL_MODE = "NO_AUTO_VALUE_ON_ZERO";
SET AUTOCOMMIT = 0;
START TRANSACTION;
SET time_zone = "+00:00";


/*!40101 SET @OLD_CHARACTER_SET_CLIENT=@@CHARACTER_SET_CLIENT */;
/*!40101 SET @OLD_CHARACTER_SET_RESULTS=@@CHARACTER_SET_RESULTS */;
/*!40101 SET @OLD_COLLATION_CONNECTION=@@COLLATION_CONNECTION */;
/*!40101 SET NAMES utf8mb4 */;

--
-- Database: `internal_nutrilo`
--

-- --------------------------------------------------------

--
-- Struktur dari tabel `account_bank`
--

CREATE TABLE `account_bank` (
  `id` int(11) NOT NULL,
  `name` varchar(30) NOT NULL,
  `bank_name` varchar(30) NOT NULL,
  `number` varchar(50) NOT NULL,
  `created_time` timestamp NOT NULL DEFAULT CURRENT_TIMESTAMP
) ENGINE=InnoDB DEFAULT CHARSET=latin1;

--
-- Dumping data untuk tabel `account_bank`
--

INSERT INTO `account_bank` (`id`, `name`, `bank_name`, `number`, `created_time`) VALUES
(1, 'Hanif Salafi', 'OVO', '082369433456', '2020-10-30 06:07:54'),
(2, 'Gio Justisia Batubara', 'BNI', '0443758197', '2020-10-30 06:07:54'),
(3, 'Ihfan Fajar Satria', 'Mandiri', '1050012000935', '2020-10-30 06:08:09');

-- --------------------------------------------------------

--
-- Struktur dari tabel `address`
--

CREATE TABLE `address` (
  `id` int(11) NOT NULL,
  `address` longtext NOT NULL,
  `delivery_date` varchar(35) NOT NULL,
  `delivery_time` varchar(35) NOT NULL,
  `delivery_notes` varchar(255) NOT NULL,
  `transaction_id` int(11) NOT NULL,
  `user_id` int(11) NOT NULL,
  `created_time` timestamp NOT NULL DEFAULT CURRENT_TIMESTAMP ON UPDATE CURRENT_TIMESTAMP
) ENGINE=InnoDB DEFAULT CHARSET=latin1 ROW_FORMAT=COMPACT;

-- --------------------------------------------------------

--
-- Struktur dari tabel `catering_buyer`
--

CREATE TABLE `catering_buyer` (
  `id` int(11) NOT NULL,
  `name` varchar(100) NOT NULL,
  `phone` varchar(20) NOT NULL,
  `address` longtext NOT NULL,
  `latlong` varchar(50) DEFAULT NULL,
  `order_batch_id` int(11) NOT NULL,
  `order_package_id` int(10) NOT NULL,
  `quantity` int(10) DEFAULT NULL,
  `nutritional_needs` longtext,
  `payment_to` int(11) NOT NULL,
  `payment_amount` varchar(15) NOT NULL,
  `payment_date` varchar(30) DEFAULT NULL,
  `batch_start_id` int(11) DEFAULT NULL,
  `day_start` int(11) DEFAULT NULL,
  `batch_end_id` int(11) DEFAULT NULL,
  `day_end` int(11) DEFAULT NULL,
  `notes` longtext,
  `driver_notes` longtext,
  `is_active` tinyint(1) NOT NULL DEFAULT '1',
  `created_time` timestamp NULL DEFAULT CURRENT_TIMESTAMP
) ENGINE=InnoDB DEFAULT CHARSET=latin1;

--
-- Dumping data untuk tabel `catering_buyer`
--

INSERT INTO `catering_buyer` (`id`, `name`, `phone`, `address`, `latlong`, `order_batch_id`, `order_package_id`, `quantity`, `nutritional_needs`, `payment_to`, `payment_amount`, `payment_date`, `batch_start_id`, `day_start`, `batch_end_id`, `day_end`, `notes`, `driver_notes`, `is_active`, `created_time`) VALUES
(4, 'Hanif', '980673956312', 'jl. Eka surya gg. Sidodadi', '3.509716, 98.668250', 1, 2, 1, 'lest salt', 2, '220000', NULL, 1, 1, 2, 5, '-', '-', 1, '2020-12-07 05:24:23'),
(6, 'gio justisia', '0823123456', 'jalan darat', '3.5393702,98.654413', 1, 3, 2, 'tidak ada', 1, '1000000', NULL, 1, 1, 2, 5, '-', '-', 1, '2020-12-07 05:24:23'),
(7, 'topik', '8735612', 'darat', '3.5254106,98.5958557', 1, 1, 1, 'asdas', 1, '239000', NULL, 1, 1, 1, 5, '12313', '-', 1, '2020-12-07 05:24:23'),
(8, 'Johan', '0823232', 'Jl. Raden Saleh Dalam No. 10', '3.589529, 98.677090', 1, 2, 1, '-', 1, '222000', NULL, 1, 1, 1, 5, '-', '-', 1, '2020-12-07 05:24:23'),
(9, 'Cheria', '0823232328047', 'BCA KCP ASIA', '3.584493, 98.691076', 1, 1, 1, '-', 1, '220000', NULL, 1, 1, 1, 5, '-', '-', 1, '2020-12-07 05:24:23'),
(10, 'Silvi', '87396854234', 'BCA JW', '3.596260, 98.676106', 1, 1, 1, '-', 1, '222000', NULL, 1, 1, 1, 5, '-', '-', 1, '2020-12-07 05:24:23'),
(11, 'Vivi', '0872323232', 'Mutiara Palace', '3.610331, 98.711799', 1, 1, 1, '-', 1, '220000', NULL, 1, 1, 1, 5, '-', '-', 1, '2020-12-07 05:24:23'),
(12, 'Puspita', '08232327953', 'Jl Seroja Raya No 144', '3.528434, 98.602867', 1, 1, 1, '-', 1, '220000', NULL, 1, 1, 1, 5, '-', '-', 1, '2020-12-07 05:24:23'),
(13, 'Ella', '082323713', 'VIlla Gading Mas 2', '3.533680, 98.697001', 1, 1, 1, '-', 1, '220000', NULL, 1, 1, 1, 5, '-', '-', 1, '2020-12-07 05:24:23'),
(14, 'Sinar irwansyah', '081377361145', 'Jl. Karya sehati no. 24', '3.530639, 98.671111', 2, 2, 1, 'Diabetes + asam urat. Karbo < 100gr, protein < 60gr. HARAM JEROAN. Kurangi kacang2an dan turunannya (tauge tempe dll)', 1, '195000', NULL, 2, 3, 3, 2, '', '-', 1, '2020-12-07 05:24:23'),
(15, 'Adriany Hasibuan 1', '082368682675', 'Jl.Bunga Ester No.64d Psr VI P.Bulan (rumahnya pas di depan gereja katolik St.Fransiskus)', '3.544960, 98.651088', 2, 3, 1, '-', 2, '1845000', NULL, 1, 5, 6, 4, 'Ada MAAGH sebelum jam 6 Dinner', '-', 1, '2020-12-07 05:24:23'),
(16, 'Levana', '087869722124', 'Jl. Emas no. 18/30, sei rengas II', '3.5847916, 98.6976904', 2, 1, 1, '-', 1, '22000', NULL, 2, 1, 2, 5, '-', '-', 1, '2020-12-07 05:24:23'),
(17, 'Debby Anggraini', '08126000357', 'Jl. Karya Jaya No. 146', '3.529349,98.676531', 2, 3, 1, 'Hipertensi + HAMIL. Less salt, less magic, less kecap yang asin. WARNING! Kalo perlu yg lain ngikut yg ini daripada yg ini ngikut yg lain!', 1, '395000', NULL, 2, 1, 2, 5, '-', '-', 1, '2020-12-07 05:24:23'),
(19, 'Cheria Lunch', '081262943669', '(LUNCH) BCA ASIA SIMPANG LAMPUNG (samping bank UOB) jl. Asia no 184D titip satpam', '3.584527,98.691058', 2, 6, 1, 'NO BEEF', 2, '1450000', NULL, 2, 1, 5, 5, 'LUNCH titip satpam. Harus sampe sebelum 11.45 !!', '-', 1, '2020-12-07 05:24:23'),
(20, 'Cheria Dinner', '081262943669', '(Dinner) Jl. Puri Gg. K Alimun no 28/59B (masuk gang, mentok belok kiri)', '3.578560,98.688845', 2, 6, 1, 'NO BEEF', 3, '0', NULL, 2, 1, 5, 5, '-', '-', 1, '2020-12-07 05:24:23'),
(21, 'Pipin Lubis', '081375876869', 'Alamat Pengiriman:jl flamboyan raya,kompleks taman asoka asri blok E no 21', '3.5487250, 98.6173930', 2, 3, 1, 'Diabetes insulin. Kecap + gula max 2 sendok makan.', 2, '395000', NULL, 2, 1, 2, 5, '-', '-', 1, '2020-12-07 05:24:23'),
(23, 'Vivita jansen', '082170287017', 'Komplek mutiara palace blok DD-33A', '3.610491,98.711592', 2, 2, 2, '-', 3, '0', NULL, 2, 1, 3, 5, '-', '-', 1, '2020-12-07 05:24:23'),
(24, 'Ariki', '08116567718', 'asia mega mas blok H no.1', '3.585245,98.703028', 2, 3, 1, '-', 2, '395000', NULL, 2, 2, 3, 1, '-', '-', 1, '2020-12-07 05:24:23'),
(25, 'Ella ', '085270376755', 'Komplek villa gading mas 2 blok DD.17', '3.533581,98.697020', 2, 3, 1, 'Hipertensi = less Salt, less magic, less kecap yg ', 2, '0', NULL, 2, 1, 2, 1, 'Tanya kelanjutan Senin malam', '-', 1, '2020-12-07 05:24:23'),
(26, 'Angelia', '08116547912', 'Jl. Tembakau Deli No 2N (Masuk di sbelah jalan Graha Merah Putih)', '3.592226,98.674562', 2, 4, 1, '-', 2, '0', NULL, 1, 1, 5, 2, '-', '-', 1, '2020-12-07 05:24:23'),
(27, 'Aurora', '081376660608', 'jln harmonika baru no.110 pasar 1 padang bulan medan selayang 20135 ( depan J&M coffee). Menu: lunch + dinner weekely.', '3.555143,98.649645', 2, 3, 1, '-', 2, '0', NULL, 1, 1, 1, 1, 'Tanya kelanjutan selasa', '-', 1, '2020-12-07 05:24:23'),
(28, 'Johan', '082366598888', 'Jl. Raden Saleh Dalam No. 10', '3.589318,98.677325', 2, 6, 1, '-', 1, '1450000', NULL, 2, 1, 5, 5, '-', '-', 1, '2020-12-07 05:24:23'),
(29, 'Cathy', '08116311184', 'jl pasar 1 gg polonia no.88 (rumah putih ujung)', '3.558715,98.629152', 2, 3, 1, '-', 2, '395000', NULL, 2, 1, 2, 5, '-', '-', 1, '2020-12-07 05:24:23'),
(30, 'Clarissia', '08126038654', 'BCA Diponegoro', '3.584618,98.672817', 2, 1, 1, 'No Beef', 1, '200000', NULL, 2, 1, 2, 5, '-', '-', 1, '2020-12-07 05:24:23'),
(31, 'dr. Novia', '08118955385', 'Oyo medan city homestay / turki family spa jln dr mansyur no 81.', '3.567458,98.647036', 2, 2, 1, '-', 2, '0', NULL, 2, 1, 3, 1, 'Rabu pause. HARUS SAMPE KE TANGANNYA SEBELUM 17.30', '-', 1, '2020-12-07 05:24:23'),
(32, 'Silvina', '081263147071', 'BCA JW MARIOT', '3.596293,98.675918', 2, 1, 1, '-', 1, '220000', NULL, 2, 1, 2, 5, '-', '-', 1, '2020-12-07 05:24:23'),
(33, 'Amerinda', '085261684301', 'Jl. Kenanga sari No. 21 Pasar 6 Tj. Sari3', '3.561760,98.639896', 2, 1, 1, '-', 1, '195000', NULL, 2, 4, 3, 3, '-', '-', 1, '2020-12-07 05:24:23'),
(35, 'Ismah Amrina ', '081263751979', 'Jl besar Tembung masuk Jl balai umum No 5 Tembung', '3.594485,98.747070', 2, 3, 1, '-', 1, '176000', NULL, 2, 4, 2, 5, '-', '-', 1, '2020-12-07 05:24:23'),
(37, 'Minar sianipar', '085361456906', 'jl. Putri hijau no. 4 ( Kanwil kementerian hukum dan ham)', '3.594459,98.676219', 3, 4, 1, '-', 2, '795000', NULL, 3, 1, 6, 5, '-', '-', 1, '2020-12-07 05:24:23'),
(38, 'Adriany Hasibuan 2', '082368682675', 'Jl.Bunga Ester No.64d Psr VI P.Bulan (rumahnya pas di depan gereja katolik St.Fransiskus)', '3.545025,98.651143', 3, 3, 1, '', 2, '3950000', NULL, 3, 1, 3, 5, 'Ada MAAGH sebelum jam 6 Dinner', '-', 1, '2020-12-07 05:24:23'),
(39, 'Amerinda', '085261684301', 'Jl. Kenangq sari No. 21 Pasae 6 Tj. Sari ', '3.561753,98.639911', 3, 1, 1, '', 1, '0', NULL, 2, 4, 3, 3, '', '-', 0, '2020-12-07 05:24:23'),
(40, 'Silvina', '081263147074', 'BCA B&G tower (JW Mariot)', '3.596149,98.675886', 3, 1, 1, '', 1, '220000', NULL, 3, 1, 3, 5, '', '-', 1, '2020-12-07 05:24:23'),
(41, 'dr. Novia', '08118955385', 'Oyo medan city homestay / turki family spa jln dr mansyur no 81.', '3.567458,98.647036', 3, 2, 1, '', 3, '00', NULL, 2, 1, 3, 1, 'harus SAMPE TANGAN sebelum 17.30', '-', 0, '2020-12-07 05:24:23'),
(43, 'Johan', '082366598888', 'Jl. Raden Saleh Dalam No. 10', '3.589318,98.677325', 3, 3, 1, '', 1, '0', NULL, 2, 1, 5, 5, '', '-', 1, '2020-12-07 05:24:23'),
(44, 'Angelia', '08116547912', 'Jl. Tembakau Deli No 2N (Masuk di sbelah jalan Graha Merah Putih)', '3.592226,98.674562', 3, 1, 1, '', 2, '0', NULL, 2, 1, 5, 2, '', '-', 1, '2020-12-07 05:24:23'),
(45, 'Ariki', '08116567718', 'Asia mega mas blok H no.1', '3.585245,98.703028', 3, 3, 1, '', 1, '0', NULL, 2, 4, 3, 1, '', '-', 0, '2020-12-07 05:24:23'),
(46, 'Vivita jansen', '082170287017', 'Komplek mutiara palace blok DD-33A', '3.610491,98.711592', 3, 2, 2, '', 3, '0', NULL, 1, 1, 3, 5, '', '-', 1, '2020-12-07 05:24:23'),
(47, 'Cheria Dinner', '081262943669', '(Dinner) Jl. Puri Gg. K Alimun no 28/59B (masuk gang, mentok belok kiri)', '3.578560,98.688845', 3, 3, 1, 'NO BEEF', 1, '0', NULL, 2, 1, 5, 5, '', '-', 1, '2020-12-07 05:24:23'),
(48, 'Cheria Lunch', '081262943669', '(LUNCH) BCA ASIA SIMPANG LAMPUNG (samping bank UOB) jl. Asia no 184D titip satpam', '3.584527,98.691058', 3, 3, 1, 'NO BEEF', 2, '0', NULL, 2, 1, 5, 5, 'LUNCH titip satpam. Harus sampe sebelum 11.45 !!', '-', 1, '2020-12-07 05:24:23'),
(49, 'Debby anggraini', '08126000357', 'Jl. Karya Jaya No. 146', '3.529349,98.676531', 3, 3, 1, 'Hipertensi + HAMIL. Less salt, less magic, less kecap yang asin. WARNING! Kalo perlu yg lain ngikut yg ini daripada yg ini ngikut yg lain!', 1, '395000', NULL, 3, 1, 3, 5, '', '-', 1, '2020-12-07 05:24:23'),
(50, 'Adriany Hasibuan 1', '082368682675', 'Jl.Bunga Ester No.64d Psr VI P.Bulan (rumahnya pas di depan gereja katolik St.Fransiskus)', '3.544960, 98.651088', 3, 3, 1, '', 2, '0', NULL, 3, 4, 6, 5, 'Ada MAAGH sebelum jam 6 Dinner', '-', 1, '2020-12-07 05:24:23'),
(51, 'Sinar irwansyah', '081377361145', 'Jl. Karya sehati no. 24', '3.530639, 98.671111', 3, 2, 1, 'Diabetes + asam urat. Karbo < 100gr, protein < 60gr. HARAM JEROAN. Kurangi kacang2an dan turunannya (tauge tempe dll)', 1, '0', NULL, 2, 3, 3, 2, '', '-', 0, '2020-12-07 05:24:23'),
(52, 'Aldila hilma', '085261951500', 'Jl.M. Idris no 47', '3.596292,98.659113', 3, 3, 1, '', 1, '395000', NULL, 3, 1, 3, 5, 'Dinner sebelum jam 6. Intermitten fasting', '-', 1, '2020-12-07 05:24:23'),
(59, 'dr. Novia', '08118955385', 'Oyo medan city homestay / turki family spa jln dr mansyur no 81.', '3.567458,98.647036', 3, 5, 1, '-', 1, '795000', NULL, 3, 2, 7, 4, 'Skip tanggal 13,17,26 november. Harus SAMPE TANGAN sebelum 17.30.', '-', 1, '2020-12-07 05:24:23'),
(64, 'Elisa', '081370639555', 'Jl pukat banting 5 no 11b', '3.594644,98.712990', 3, 1, 1, '', 1, '195000', NULL, 3, 4, 4, 3, '', '', 1, '2020-12-07 05:24:23'),
(65, 'Elisa', '081370639555', 'Jalan pukat banting 5 no 11b', '3.594644,98.712990', 4, 1, 1, '', 1, '0', NULL, 3, 4, 4, 3, '', '', 0, '2020-12-07 05:24:23'),
(66, 'dr. Novia', '08118955385', 'Oyo medan city homestay / turki family spa jln dr mansyur no 81.', '3.567458,98.647036', 4, 5, 1, '-', 1, '0', NULL, 3, 2, 7, 4, 'Skip tanggal 13,17,26 november.', '-Harus SAMPE TANGAN sebelum 17.30.', 1, '2020-12-07 05:24:23'),
(67, 'dr. Novia', '08118955385', 'Oyo medan city homestay / turki family spa jln dr mansyur no 81.', '3.567458,98.647036', 5, 5, 1, '-', 1, '0', NULL, 3, 2, 7, 4, 'Skip tanggal 13,17,26 november.', '-Harus SAMPE TANGAN sebelum 17.30.', 1, '2020-12-07 05:24:23'),
(68, 'dr. Novia', '08118955385', 'Oyo medan city homestay / turki family spa jln dr mansyur no 81.', '3.567458,98.647036', 6, 5, 1, '-', 1, '0', '', 3, 2, 7, 4, 'Skip tanggal 13,17,26 november.', '-Harus SAMPE TANGAN sebelum 17.30.', 1, '2020-12-07 05:24:23'),
(69, 'dr. Novia', '08118955385', 'Oyo medan city homestay / turki family spa jln dr mansyur no 81.', '3.567458,98.647036', 7, 5, 1, 'SAYUR NYA MINTA DIBANYAKIN', 1, '0', '', 3, 2, 7, 4, 'Skip tanggal 13,17,26 november.Skip 8,16,24 desember', '-Harus SAMPE TANGAN sebelum 17.30.', 1, '2020-12-07 05:24:23'),
(70, 'Adriany Hasibuan 1', '082368682675', 'Jl.Bunga Ester No.64d Psr VI P.Bulan (rumahnya pas di depan gereja katolik St.Fransiskus)', '3.544960, 98.651088', 4, 3, 1, '', 2, '0', NULL, 3, 4, 6, 5, 'Ada MAAGH sebelum jam 6 Dinner', '-sebelum jam 6 Dinner', 1, '2020-12-07 05:24:23'),
(71, 'Adriany Hasibuan 1', '082368682675', 'Jl.Bunga Ester No.64d Psr VI P.Bulan (rumahnya pas di depan gereja katolik St.Fransiskus)', '3.544960, 98.651088', 5, 3, 1, '', 2, '0', NULL, 3, 4, 6, 5, 'Ada MAAGH sebelum jam 6 Dinner', '-sebelum jam 6 Dinner', 1, '2020-12-07 05:24:23'),
(72, 'Adriany Hasibuan 1', '082368682675', 'Jl.Bunga Ester No.64d Psr VI P.Bulan (rumahnya pas di depan gereja katolik St.Fransiskus)', '3.544960, 98.651088', 6, 6, 1, '', 2, '0', '', 3, 4, 6, 5, 'Ada MAAGH sebelum jam 6 Dinner', '-sebelum jam 6 Dinner', 1, '2020-12-07 05:24:23'),
(73, 'Cheria Lunch', '081262943669', '(LUNCH) BCA ASIA SIMPANG LAMPUNG (samping bank UOB) jl. Asia no 184D titip satpam', '3.584527,98.691058', 4, 3, 1, 'NO BEEF', 2, '0', NULL, 2, 1, 5, 5, '', '-LUNCH titip satpam. Harus sampe sebelum 11.45 !!', 1, '2020-12-07 05:24:23'),
(74, 'Cheria Lunch', '081262943669', '(LUNCH) BCA ASIA SIMPANG LAMPUNG (samping bank UOB) jl. Asia no 184D titip satpam', '3.584527,98.691058', 5, 3, 1, 'NO BEEF', 2, '0', NULL, 2, 1, 5, 5, '', '-LUNCH titip satpam. Harus sampe sebelum 11.45 !!', 1, '2020-12-07 05:24:23'),
(75, 'Cheria Dinner', '081262943669', '(Dinner) Jl. Puri Gg. K Alimun no 28/59B (masuk gang, mentok belok kiri)', '3.578560,98.688845', 4, 3, 1, 'NO BEEF', 1, '0', NULL, 2, 1, 5, 5, 'rabu&kamis lunch&diner di antar barengan sama johan ke jl raden saleh dalam', '-', 1, '2020-12-07 05:24:23'),
(76, 'Cheria Dinner', '081262943669', '(Dinner) Jl. Puri Gg. K Alimun no 28/59B (masuk gang, mentok belok kiri)', '3.578560,98.688845', 5, 3, 1, 'NO BEEF', 1, '0', NULL, 2, 1, 5, 5, '', '-', 1, '2020-12-07 05:24:23'),
(77, 'Angelia', '08116547912', 'Jl. Tembakau Deli No 2N (Masuk di sbelah jalan Graha Merah Putih)', '3.592226,98.674562', 4, 1, 1, '', 2, '0', NULL, 2, 1, 5, 2, '', '-', 1, '2020-12-07 05:24:23'),
(78, 'Angelia', '08116547912', 'Jl. Tembakau Deli No 2N (Masuk di sbelah jalan Graha Merah Putih)', '3.592226,98.674562', 5, 1, 1, '', 2, '0', NULL, 2, 1, 5, 2, '', '-', 0, '2020-12-07 05:24:23'),
(79, 'Minar sianipar', '085361456906', 'jl. Putri hijau no. 4 ( Kanwil kementerian hukum dan ham)', '3.594459,98.676219', 4, 4, 1, '-', 2, '0', '', 3, 1, 6, 5, '-', '-', 1, '2020-12-07 05:24:23'),
(80, 'Minar sianipar', '085361456906', 'jl. Putri hijau no. 4 ( Kanwil kementerian hukum dan ham)', '3.594459,98.676219', 5, 4, 1, '-', 2, '0', NULL, 3, 1, 6, 5, '-', '-', 1, '2020-12-07 05:24:23'),
(81, 'Minar sianipar', '085361456906', 'jl. Putri hijau no. 4 ( Kanwil kementerian hukum dan ham)', '3.594459,98.676219', 6, 4, 1, '-', 2, '0', '', 3, 1, 6, 5, '-', '-', 1, '2020-12-07 05:24:23'),
(82, 'Adriany Hasibuan 2', '082368682675', 'Jl.Bunga Ester No.64d Psr VI P.Bulan (rumahnya pas di depan gereja katolik St.Fransiskus)', '3.545025,98.651143', 4, 3, 1, '', 2, '3950000', NULL, 4, 1, 4, 5, 'Ada MAAGH sebelum jam 6 Dinner', '-', 1, '2020-12-07 05:24:23'),
(83, 'Fenny tjandra 1', '082167629636', 'JL flamboyan kompek cemara asrino.45 masuk dari bank OCBC', '3.633560,98.696976', 4, 1, 1, '', 1, '0', NULL, 4, 1, 5, 1, '', 'Di samping Wie Wie Louhan', 1, '2020-12-07 05:24:23'),
(84, 'Fendro Chandra', '088226699602', 'Bank bca cabang diponegoro jl diponegoro', '3.584043,98.673261', 4, 1, 1, '', 1, '0', NULL, 4, 1, 4, 5, '', '', 1, '2020-12-07 05:24:23'),
(85, 'Stefanie', '085922873090', 'Jl.dagan no.5B/6A Belakang plaza medan fair', '3.593269,98.666074', 4, 1, 1, '', 1, '0', NULL, 4, 2, 4, 5, '', '', 1, '2020-12-07 05:24:23'),
(86, 'Silvina', '081263147074', 'BCA B&G tower (JW Mariot)', '3.596149,98.675886', 4, 1, 1, '', 1, '220000', NULL, 4, 1, 4, 5, '', '-', 1, '2020-12-07 05:24:23'),
(87, 'Amerinda', '085261684301', 'Jl. Kenangq sari No. 21 Pasae 6 Tj. Sari ', '3.561753,98.639911', 4, 1, 1, '', 1, '220000', NULL, 4, 1, 4, 5, '', '-', 1, '2020-12-07 05:24:23'),
(88, 'atina', '085270645541', 'Jl.pembangunan usu no.12', '3.5666580,98.6522182', 4, 1, 1, '', 2, '195000', NULL, 4, 1, 4, 5, '', '', 1, '2020-12-07 05:24:23'),
(89, 'Haliza', '085922835009', 'Jl suka baru no.18,padang bulan selayang 1', '3.5686427,98.6507564', 4, 1, 1, '', 2, '195000', NULL, 4, 1, 4, 5, '', 'Rumah kos tentrem telefon atau chat orang nya setelah dititipkan ke satpam', 1, '2020-12-07 05:24:23'),
(90, 'Fauziah', '08116002126', 'Jl pembangunan no 12', '3.5666580,98.6522182', 4, 1, 1, '', 2, '195000', NULL, 4, 1, 4, 5, '', '', 1, '2020-12-07 05:24:23'),
(91, 'Ratu', '082164218775', 'Jl bakti indah III no.217 komplek tata alam asri', '3.607983,98.620612', 4, 1, 2, '', 1, '0', NULL, 4, 1, 4, 5, '', '', 1, '2020-12-07 05:24:23'),
(92, 'Puput utami', '08116319915', 'Jl sidodadi komplek johor Regency Blok B no,1', '3.508880,98.665949', 4, 1, 1, '', 1, '0', NULL, 4, 1, 4, 5, 'No ikan air tawar', '', 1, '2020-12-07 05:24:23'),
(93, 'Debby anggraini', '08126000357', 'Jl. Karya Jaya No. 146', '3.529349,98.676531', 4, 3, 2, 'Hipertensi + HAMIL. Less salt, less magic, less kecap yang asin. WARNING! Kalo perlu yg lain ngikut yg ini daripada yg ini ngikut yg lain!    No udang', 1, '790000', NULL, 4, 1, 4, 5, '', '-', 1, '2020-12-07 05:24:23'),
(94, 'Juliaty Ginting', '081361447314', 'jl pasar baru no 43 padang bulan', '3.552058,98.654967', 4, 3, 1, 'No Ayam, No Nasi merah', 1, '395000', NULL, 4, 1, 4, 5, 'Skip rabu - jumat keluar kota. Ganti di batch 32', '', 0, '2020-12-07 05:24:23'),
(95, 'Aldila hilma', '085261951500', 'Jl.M. Idris no 47', '3.596292,98.659113', 4, 3, 1, '', 2, '395000', NULL, 4, 1, 4, 5, 'Dinner sebelum jam 6. Intermitten fasting', 'Mohon diterima penbayaran cash ke pengantar', 1, '2020-12-07 05:24:23'),
(96, 'Johan', '0823000022222', 'Jl. Raden Saleh Dalam No. 10', '3.589318,98.677325', 4, 3, 1, '', 1, '0', NULL, 2, 1, 5, 5, '', '-', 1, '2020-12-07 05:24:23'),
(97, 'Johan', '082366598888', '', '3.589318,98.677325', 5, 3, 1, '', 1, '0', '', 2, 1, 5, 5, '', '-', 1, '2020-12-07 05:24:23'),
(98, 'Fionna Blenda', '08118032109', 'kompleks malibu indah blok H-36.', '3.550728,98.684386', 4, 1, 1, '', 1, '0', NULL, 4, 2, 4, 6, '', '', 1, '2020-12-07 05:24:23'),
(99, 'Christy', '08116130478', 'Jl sampali baru komplek sampali baru No.9J', '3.593723,98.698358', 4, 1, 1, '', 2, '195000', NULL, 4, 4, 6, 3, 'selang seling dari tanggan 19nov,24nov,26nov,1des,sampai 3des', '', 1, '2020-12-07 05:24:23'),
(100, 'Christy', '08116130478', 'Jl sampali baru komplek sampali baru No.9J', '3.593723,98.698358', 5, 1, 1, 'Vegetarian', 2, '0', NULL, 4, 4, 6, 3, 'selang seling dari tanggan 19nov,24nov,26nov,1des,sampai 3des', '', 1, '2020-12-07 05:24:23'),
(101, 'Christy', '08116130478', 'Jl sampali baru komplek sampali baru No.9J', '3.593723,98.698358', 6, 1, 1, '', 2, '0', '', 4, 4, 6, 3, 'selang seling dari tanggan 19nov,24nov,26nov,1des,sampai 3des', '', 1, '2020-12-07 05:24:23'),
(102, 'Juliaty Ginting', '081361447314', 'jl pasar baru no 43 padang bulan', '3.552058,98.654967', 5, 3, 1, 'No Ayam, No Nasi merah', 1, '0', NULL, 5, 1, 5, 3, 'Skip rabu - jumat keluar kota. Ganti di batch 32 hari senin - rabu', '', 0, '2020-12-07 05:24:23'),
(103, 'Alvero', '081333363189', 'Jl persatuan,komplek surya regency 1 Blok c No.8', '3.612504,98.652852', 4, 3, 1, '', 2, '396000', NULL, 4, 4, 5, 3, '', 'Cantolin aja makanannya di pintu besi dalam.BUKAN PAGAR. Setelah itu  fotokan lalu chat beliau.GA BISA DITELEFON', 1, '2020-12-07 05:24:23'),
(104, 'Alvero', '081333363189', 'Jl persatuan,komplek surya regency 1 Blok c No.8', '3.612504,98.652852', 5, 3, 1, '', 2, '0', NULL, 4, 4, 5, 3, '', 'Cantolin aja makanannya di pintu besi.BUKAN PAGAR. Setelah itu  fotokan lalu chat beliau.GA BISA DITELEFON', 0, '2020-12-07 05:24:23'),
(107, 'Silvia', '081362420122', 'Jl persamaan Gg rahmat No.77 simpang limun', '3.551046,98.696498', 5, 1, 1, 'HIGH PROTEIN (> 70gr). Beef, ikan, ayam minimal 150gr, udang minimal 200 gr. KARBO DISIKITIN < 50gr ! NO NASI MERAH/PUTIH', 1, '390000', '', 5, 1, 6, 5, '', '', 1, '2020-12-07 05:24:23'),
(108, 'Silvia', '081362420122', 'Jl. persamaan. Gg. rahmat. No.77. simpang. limun', '3.551046,98.696498', 6, 1, 1, 'HIGH. PROTEIN. (>. 70gr).. Beef,. ikan,. ayam. minimal. 150gr,. udang. minimal. 200. gr.. Nasi,pasta,spaghetti,kentang,dan. karbo. lain. DIBAWAH. 65gr', 1, '0', '', 5, 1, 6, 5, '', '', 1, '2020-12-07 05:24:23'),
(110, 'Nitya', '08116438586', 'Jne Gatsu (sebelah GG harapan seberang Tomang elok)', '3.590999,98.641123', 5, 1, 1, '', 2, '195000', NULL, 5, 1, 5, 5, '', '', 1, '2020-12-07 05:24:23'),
(111, 'Ginda laura ', '08116483008', 'Jl Bunga Ester No.93C Medan Selayang Pasar 6 Padang bulan', '3.544701,98.652720', 5, 1, 1, '', 1, '19500', NULL, 5, 1, 5, 5, '', '', 1, '2020-12-07 05:24:23'),
(112, 'Clarissia', '08126038654', 'BCA Diponegoro', '3.584618,98.672817', 5, 1, 1, 'No Beef', 1, '200000', NULL, 5, 1, 5, 5, '-', '-', 1, '2020-12-07 05:24:23'),
(113, 'Ismah Amrina ', '081263751979', 'Jl besar Tembung masuk Jl balai umum No 5 Tembung', '3.594485,98.747070', 5, 3, 1, '-', 1, '80000', NULL, 5, 1, 5, 1, '-', '-', 0, '2020-12-07 05:24:23'),
(114, 'Demmy putri', '081264600407', 'ZAP klinik Jl. Iskandar muda no 81 Medan (Sebelah BRI AGRO).', '3.581344,98.661068', 5, 1, 1, '', 1, '195000', NULL, 5, 1, 5, 5, '', '', 1, '2020-12-07 05:24:23'),
(115, 'Silvina', '08163147074', 'BCA B&G tower (JW Mariot)', '3.596149,98.675886', 5, 1, 1, '', 1, '220000', NULL, 5, 1, 5, 5, '', '', 1, '2020-12-07 05:24:23'),
(116, 'Fajar', '082294755949', 'Jl Karya jaya gg eka pribadi', '3.518387,98.676233', 5, 2, 1, 'Kolesterol dan asam urat tinggi. Jangan berminyak x, daging ayam, ikan, jamur TIDAK LEBIH 80 gram, kurangi biji2an, kacang2an, kol, dan bayam. HARAM Jeroan', 2, '195000', NULL, 5, 1, 5, 5, '', '', 1, '2020-12-07 05:24:23'),
(117, 'Fenny tjandra 1', '082167629636', 'Jl Flamboyan komplek cemara asri No.45 masuk dari bank OCBC', '3.633560,98.696976', 5, 1, 1, '', 1, '0', NULL, 4, 1, 5, 1, '', 'disamping Wie Wie louhan', 0, '2020-12-07 05:24:23'),
(118, 'Amerinda', '085261684301', 'Jl. Kenangq sari No. 21 Pasae 6 Tj. Sari ', '3.561753,98.639911', 5, 1, 1, '', 1, '220000', NULL, 5, 1, 5, 5, '', '-', 1, '2020-12-07 05:24:23'),
(119, 'Debby anggraini', '08126000357', 'Jl. Karya Jaya No. 146', '3.529349,98.676531', 5, 3, 2, 'Hipertensi + HAMIL. Less salt, less magic, less kecap yang asin. WARNING! Kalo perlu yg lain ngikut yg ini daripada yg ini ngikut yg lain!    No udang', 1, '0', NULL, 5, 1, 5, 5, 'LUNCH 1 DINNER 2', '-', 1, '2020-12-07 05:24:23'),
(120, 'Fifi', '087825567898', 'Jl.Kereta Api Baru No.10B ; Kesawan ; Medan Barat', '3.589103,98.680338', 5, 3, 1, '', 1, '395000', '', 5, 1, 5, 5, '', 'Pengiriman lewat pintu belakang, masuk dari gang di samping rumah Jl.Perniagaan Baru no. 20C', 1, '2020-12-07 05:24:23'),
(121, 'Dilla', '081376296007', 'JL. Mojopahit ujung No. 69 A (Depan Yona Cafe). Pagar htam yg ada ring basket. Medan 20153', '3.575552,98.665248', 5, 2, 1, 'HIGH PROTEIN (> 70gr). Beef, ikan, ayam minimal 150gr, udang minimal 200 gr. KARBO DISIKITIN < 50gr !', 2, '395000', '', 5, 1, 6, 5, 'PAKAI MENU LUNCH', '(Depan Yona Cafe) Pagar htam yg ada ring basket ', 1, '2020-12-07 05:24:23'),
(122, 'Dilla', '081376296007', 'JL.. Mojopahit. ujung. No.. 69. A. (Depan. Yona. Cafe).. Pagar. htam. yg. ada. ring. basket.. Medan. 20153', '3.575552,98.665248', 6, 2, 1, 'HIGH. PROTEIN. (>. 70gr).. Beef,. ikan,. ayam. minimal. 150gr,. udang. minimal. 200. gr.. Nasi,pasta,spaghetti,kentang,dan. karbo. lain. DIBAWAH. 65gr', 2, '0', '', 5, 1, 6, 5, 'PAKAI. MENU. LUNCH', '(Depan. Yona. Cafe). Pagar. htam. yg. ada. ring. basket. ', 1, '2020-12-07 05:24:23'),
(123, 'Adriany Hasibuan 2', '082368682675', 'jl Bunga ester No.46d psr VI .bulan (rumahnya pas didepan greja katolik St.Fransiskus)', '3.545025,98.651143', 5, 3, 1, '', 2, '395000', '', 5, 1, 5, 5, 'ada MAAGH sebelum jam 6', '', 1, '2020-12-07 05:24:23'),
(127, 'Gita Aisyah', '081265350015', 'Komplek tasbi 2 blok 1 No.43', '3.567955,98.625770', 5, 1, 1, '', 3, '0', '', 5, 3, 5, 5, '', '', 1, '2020-12-07 05:24:23'),
(128, 'Nesya Ardella', '08113677431', 'Perumahan Medan Resort City (Mercy) Rotterdam blok K06 kec.Deli Tua', '3.512107,98.675058', 5, 3, 1, '', 2, '685000', '', 5, 4, 6, 3, 'LUNCH 1 DINNER 2', '', 1, '2020-12-07 05:24:23'),
(129, 'Nesya Ardella', '08113677431', 'Perumahan Medan Resort City (Mercy) Rotterdam blok K06 kec.Deli Tua', '3.512107,98.675058', 6, 3, 1, '', 2, '0', '', 5, 4, 6, 3, 'LUNCH 1 DINNER 2', '', 1, '2020-12-07 05:24:23'),
(130, 'Willi', '082167888811', 'Jl s parman no 217, cambridge apartemen tower picasso lantai 21 (dari zainul arifin, pas sebelum tanjakan turun starbucks cambridge ada gerbang besi, drop off ke security sana saja).', '3.584218,98.667676', 6, 2, 1, 'NO BEEF', 1, '195000', '', 6, 1, 6, 5, '', '( dari zainul arifin, pas sebelum tanjakan turun starbucks cambridge ada gerbang besi, drop off ke security sana saja )', 1, '2020-12-07 05:24:23'),
(131, 'Amelia', '08126522057', 'Tirta investama jl kapten soemarsono No 74', '3.615893,98.641688', 6, 1, 1, 'Nasi,pasta,spaghetti,kentang,dan karbo lain DIBAWAH 65gr', 1, '395000', '', 6, 1, 7, 5, '', '', 1, '2020-12-07 05:24:23'),
(132, 'Amelia', '08126522057', 'Tirta investama jl kapten soemarsono No 74', '3.615893,98.641688', 7, 2, 1, '', 1, '0', '', 6, 1, 7, 5, '', '', 1, '2020-12-07 05:24:23'),
(133, 'Sharee ', '085805618529', 'Jl Bintang No.1B/17(sederet RM samudra)', '3.594740,98.686869', 6, 3, 1, 'NO BEEF', 1, '395000', '', 6, 1, 6, 5, 'Reques aglio olio', '', 1, '2020-12-07 05:24:23'),
(134, 'Winna kartika', '087869090150', 'Jl. Menteng VII gg. Kesatria no. 20 Medan', '3.566334,98.725043', 6, 1, 1, 'Nasi,pasta,spaghetti,kentang,dan karbo lain DIBAWAH 65gr', 2, '195000', '', 6, 1, 6, 5, '', '', 1, '2020-12-07 05:24:23'),
(135, 'Didi ', '082370402979', 'ACC ADAM MALIK, Jalan adam malik no.28 (sebelah prudential dan yamaha)', '3.597241,98.66928', 6, 1, 1, '', 2, '195000', '', 6, 1, 6, 5, '', '', 1, '2020-12-07 05:24:23'),
(136, 'Agung rachmawati', '081291818777', 'Jl beringin 4 No.173 gaperta masuk dari samping doorsmear arwana', '3.606051,98.627375', 6, 3, 1, 'Tidak bisa IKAN LAUT kecuali dorry. Semua ikan tawar bisa', 2, '395000', '', 6, 1, 6, 5, '', '', 1, '2020-12-07 05:24:23'),
(137, 'Melsa pratiwi', '082260912490', 'Garuda indonesia jl mongonsidi No.34A depan hermes', '3.571363,98.666801', 6, 1, 1, 'GAK makan nasi merah dan putih. ALERGI PEPAYA, NENAS, BUNCIS', 1, '195000', '', 6, 1, 6, 5, '', '', 1, '2020-12-07 05:24:23'),
(138, 'Tanty anggraeni s', '081377060515', 'Polda sumut pintu 3', '3.530834,98.737646', 6, 1, 1, 'Nasi,pasta,spaghetti,kentang,dan karbo lain DIBAWAH 65gr', 2, '195000', '', 6, 1, 6, 5, '', '', 1, '2020-12-07 05:24:23'),
(139, 'Johan', '082366598888', 'Jl raden saleh dalam No.10', '3.589318,98.677325', 6, 6, 1, '', 1, '145000', '', 6, 1, 10, 1, '', '-', 1, '2020-12-07 05:24:23'),
(140, 'Johan', '082366598888', 'Jl raden saleh dalam No.10', '3.589318,98.677325', 7, 3, 1, '', 1, '0', '', 6, 1, 7, 5, '', '-', 1, '2020-12-07 05:24:23'),
(141, 'Cheria Lunch', '081262943669', '(LUNCH) BCA ASIA SIMPANG LAMPUNG (samping bank UOB) jl. Asia no 184D titip satpam', '3.584527,98.691058', 6, 4, 1, 'NO BEEF', 2, '0', '', 6, 1, 9, 5, '', '-LUNCH titip satpam. Harus sampe sebelum 11.45 !!', 1, '2020-12-07 05:24:23'),
(142, 'Cheria Lunch', '081262943669', '(LUNCH) BCA ASIA SIMPANG LAMPUNG (samping bank UOB) jl. Asia no 184D titip satpam', '3.584527,98.691058', 7, 4, 1, 'NO BEEF', 2, '0', '', 6, 1, 9, 5, '', '-LUNCH titip satpam. Harus sampe sebelum 11.45 !!', 1, '2020-12-07 05:24:23'),
(143, 'Cheria Dinner', '081262943669', '(Dinner) Jl. Puri Gg. K Alimun no 28/59B (masuk gang, mentok belok kiri)', '3.578560,98.688845', 6, 5, 1, 'NO BEEF', 1, '145000', '', 6, 1, 9, 5, '', '-', 1, '2020-12-07 05:24:23'),
(144, 'Clarissia', '08126038654', 'BCA Diponegoro', '3.584618,98.672817', 6, 1, 1, 'No Beef', 1, '200000', '', 6, 1, 6, 5, '-', '-', 1, '2020-12-07 05:24:23'),
(145, 'Silvina', '08163147074', 'BCA B&G tower (JW Mariot)', '3.596149,98.675886', 6, 1, 1, '', 1, '220000', '', 6, 1, 6, 5, '', '', 1, '2020-12-07 05:24:23'),
(146, 'Kartika Yusuf', '082366317224', 'Aquilla Residence 9i-j, Jl. Garuda No.28, Sei Sikambing B', '3.588473,98.639954', 6, 1, 1, '', 3, '0', '', 6, 1, 6, 5, '', '', 1, '2020-12-07 05:24:23'),
(147, 'Cathy', '08116311184', 'jl pasar 1 gg polonia no.88 (rumah putih ujung)', '3.558715,98.629152', 6, 1, 1, '-', 2, '195000', '', 6, 1, 6, 5, '-', '-', 1, '2020-12-07 05:24:23'),
(148, 'Debby anggraini', '08126000357', 'Jl. Karya Jaya No. 146', '3.529349,98.676531', 6, 3, 2, 'Hipertensi + HAMIL. Less salt, less magic, less kecap yang asin. WARNING! Kalo perlu yg lain ngikut yg ini daripada yg ini ngikut yg lain!    No udang', 1, '720000', '', 6, 1, 6, 5, '', '-', 1, '2020-12-07 05:24:23'),
(149, 'Ola sembiring', '082273508719', 'Jl bunga asoka komplek asoka raya residance blok d57. Ringroad medan', '3.564046,98.622653', 6, 1, 1, 'ALERGI AYAM!! Nasi,pasta,spaghetti,kentang,dan karbo lain DIBAWAH 65gr', 2, '195000', '', 6, 3, 7, 2, '', '', 1, '2020-12-07 05:24:23'),
(150, 'Ola sembiring', '082273508719', 'Jl bunga asoka komplek asoka raya residance blok d57. Ringroad medan', '3.564046,98.622653', 7, 1, 1, 'ALERGI AYAM & UDANG. Nasi,pasta,spaghetti,kentang,dan karbo lain DIBAWAH 65gr', 2, '0', '', 6, 3, 7, 2, '', '', 1, '2020-12-07 05:24:23'),
(154, 'Mardhiyah Harahap', '081261925277', 'Jl.. Asrama,. RS. Hermina. Medan,. Sei. Sikambing. atau. Jl.. Asrama,. Komplek. Bumi. Asrk. No. A16', '3.595367,98.627378', 6, 6, 1, 'Nasi,pasta,spaghetti,kentang,dan. karbo. lain. DIBAWAH. 65gr', 2, '1450000', '02-12-2020', 6, 3, 9, 2, '', '', 1, '2020-12-07 05:24:23'),
(155, 'Mardhiyah Harahap', '081261925277', 'Jl. Asrama, RS Hermina Medan, Sei Sikambing atau Jl. Asrama, Komplek Bumi Asrk No A16', '3.595367,98.627378', 7, 6, 1, 'Nasi,pasta,spaghetti,kentang,dan karbo lain DIBAWAH 65gr', 2, '0', '', 6, 3, 9, 2, '', '', 1, '2020-12-07 05:24:23'),
(158, 'Hitri', '082167630320', 'Jl.. Asrama,. RS. Hermina. Medan', '3.595367,98.627378', 6, 1, 1, '', 2, '195000', '02-12-2020', 6, 3, 6, 2, '', '', 1, '2020-12-07 05:24:23'),
(159, 'Devi Haslan', '082304195747', 'Jl. r.a. kartini. no. 26. /. Tamoe. coffee. and. resto', '3,5800774, 98,6741466', 6, 3, 1, '', 1, '90000', '02-12-2020', 6, 4, 6, 4, '', '', 1, '2020-12-07 05:24:23'),
(160, 'Devi Haslan', '082304195747', 'Jl. r.a kartini. no. 26 / Tamoe coffee and resto', '3.5800774, 98.6741466', 7, 1, 1, 'Alergi ikan', 1, '220000', '04-12-2020', 7, 1, 7, 5, 'HARI RABU SKIP DIGANTI KE DINNER KAMIS', '', 1, '2020-12-07 05:24:23'),
(161, 'Dilla', '081376296007', 'Jl. Mojopahit ujung, No 69A (Depan Yona Cafe). Pagar hitam yg ada ring basket. Medan. 20153', '3.575552,98.665248', 7, 5, 1, 'HIGH PROTEIN (> 70gr). Beef, ikan, ayam minimal 150gr, udang minimal 200gr. Nasi,pasta,spaghetti,kentang,dan karbo lain DIBAWAH 65gr.', 2, '795000', '04-12-2020', 7, 1, 10, 5, 'PAKAI MENU LUNCH', '(Depan Yona Cafe) Pagar htam yg ada ring basket.', 1, '2020-12-07 05:24:23'),
(162, 'Dilla', '081376296007', 'JL. Mojopahit ujung No. 69A', '3.575552,98.665248', 8, 5, 1, 'HIGH PROTEIN. Beef, ikan, ayam minimal 80 - 100gr, udang atay cumi minimal 100 gr. Nasi, pasta, spaghetti, kentang, dan karbo lain DIBAWAH 60gr. Tambahlan putih telur 2 butir', 2, '0', '', 7, 1, 10, 1, 'PAKAI MENU LUNCH Siap tanggal 28 ganti hari rabu', '(Depan Yona Cafe) Pagar htam yg ada ring basket', 1, '2020-12-07 05:24:23'),
(163, 'Dilla', '081376296007', 'JL... Mojopahit.. ujung.. No... 69.. A.. (Depan.. Yona.. Cafe)... Pagar.. htam.. yg.. ada.. ring.. basket... Medan.. 20153', '3.575552,98.665248', 9, 5, 1, 'HIGH PROTEIN & DIET', 2, '0', '', 7, 1, 10, 5, 'PAKAI.. MENU.. LUNCH skip tgl 9,24,25,26,27,31,1,2,3 desember', '(Depan.. Yona.. Cafe).. Pagar.. htam.. yg.. ada.. ring.. basket.. ', 1, '2020-12-07 05:24:23'),
(164, 'Willi', '082167888811', 'Jl s parman no 217, cambridge apartemen tower picasso lantai 21', '3.584218,98.667676', 7, 2, 1, 'NO BEEF. KETO DIET (NO karbo, buah, nasi, pasta, roti, kentang, spaghetti, dll) ganti slot pake sayur sayuran telor atau side dish lain.', 1, '440000', '05-12-2020', 7, 1, 8, 5, 'Batch 35 Less Salt', '( dari zainul arifin, pas sebelum tanjakan turun starbucks cambridge ada gerbang besi, drop off ke security sana saja )', 1, '2020-12-07 05:24:23'),
(165, 'Willi', '082167888811', 'Jl s parman no 217, cambridge apartemen tower picasso lantai 21 (dari zainul arifin, pas sebelum tanjakan turun starbucks cambridge ada gerbang besi, drop off ke security sana saja).', '3.584218,98.667676', 8, 2, 1, 'NO BEEF. Less salt, less magic, less kecap yang asin, less mayo, less mentega. Kalo bisa HAMBAR aja', 1, '0', '', 7, 1, 9, 1, 'Siap tanggal 28 ganti hari rabu', '( dari zainul arifin, pas sebelum tanjakan turun starbucks cambridge ada gerbang besi, drop off ke security sana saja )', 1, '2020-12-07 05:24:23'),
(166, 'Elyana', '081973435336', 'Platinum garden katamso sebelah sekolah wr supratman Blok A17', '3.545625,98.687222', 7, 1, 1, 'NO NASI MERAH', 1, '195000', '05-12-2020', 7, 1, 7, 5, '', '', 1, '2020-12-07 05:24:23'),
(167, 'Ika ', '085358941117', 'Jl Panglima Denai Menteng 7 Komplek The Grand Menteng Indah Cluster The Green No.8 b Medan', '3.5538551, 98.7235720', 7, 1, 1, 'TANPA NASI', 2, '245000', '06-12-2020', 7, 1, 7, 5, 'Bayar ongkir', '-', 1, '2020-12-07 05:24:23'),
(168, 'Tanty anggraeni s', '081377060515', 'Polda sumut pintu 3', '3.530834,98.737646', 7, 1, 1, 'Nasi,pasta,spaghetti,kentang,dan karbo lain DIBAWAH 65gr', 2, '0', '', 7, 1, 7, 1, 'Ganti 1 hari yg telat', '', 1, '2020-12-07 05:24:23'),
(169, 'Melsa pratiwi', '082260912490', 'Garuda indonesia jl mongonsidi No.34A depan hermes', '3.571363,98.666801', 7, 4, 1, 'GAK makan nasi merah dan putih. ALERGI PEPAYA, NENAS, BUNCIS', 2, '795000', '06-12-2020', 7, 1, 9, 5, '', '', 1, '2020-12-07 05:24:23'),
(170, 'Melsa pratiwi', '082260912490', 'Garuda indonesia jl mongonsidi No.34A depan hermes', '3.571363,98.666801', 8, 4, 1, 'NO NASI. ALERGI PEPAYA, NENAS, BUNCIS', 2, '0', '', 7, 1, 10, 1, 'Siap di tanngal 28 mengganti hari rabu skip tnggl  18 des', '', 1, '2020-12-07 05:24:23'),
(171, 'Melsa pratiwi', '082260912490', 'Garuda indonesia jl mongonsidi No.34A depan hermes', '3.571363,98.666801', 9, 4, 1, 'NO NASI & ALERGI PEPAYA, NENAS, BUNCIS', 2, '0', '', 7, 1, 10, 5, 'Skip tgl 9,21,24,25,26,27,31,1,2,3 desember', '', 1, '2020-12-07 05:24:23'),
(172, 'Shintha', '08116298000', 'Kantor Garuda Indonesia Jl. Mongonsidi No. 34 A.', '3.571451,98.666901', 7, 1, 1, 'No nasi', 2, '195000', '06-12-2020', 7, 1, 7, 5, '', '', 1, '2020-12-07 05:24:23'),
(173, 'Eva', '085361045222', 'Jl. Rahmadsyah 416-C Medan (praktek dr.muzahar, sebelah gg sekolah)', '3.5794745, 98.6953237', 7, 1, 1, 'Hipertensi. Less salt, less magic, less kecap yang asin.', 1, '220000', '06-12-2020', 7, 1, 7, 5, '', '', 1, '2020-12-07 05:24:23'),
(174, 'Winna kartika', '087869090150', 'Jl. Menteng VII gg. Kesatria no. 20 Medan', '3.566334,98.725043', 7, 1, 1, 'Nasi,pasta,spaghetti,kentang,dan karbo lain DIBAWAH 65gr. NO PEDAS', 1, '176000', '06-12-2020', 7, 1, 7, 5, '', '', 1, '2020-12-07 05:24:23'),
(175, 'Silvina', '08163147074', 'BCA B&G tower (JW Mariot)', '3.596149,98.675886', 7, 1, 1, '', 1, '220000', '06-12-2020', 7, 1, 7, 5, '', '', 1, '2020-12-07 05:24:23'),
(176, 'Sofie', '081362124060', 'Jl amaliun gg johar no 16', '3.575142,98.694893', 7, 1, 1, 'Nasi,pasta,spaghetti,kentang,dan karbo lain DIBAWAH 65gr', 1, '175000', '', 7, 1, 7, 5, '', 'blok mawar no 36-37 smraja (rumah putih)', 1, '2020-12-07 05:24:23'),
(177, 'Dr vira', '081377402344', 'Jl garu 2 villa harjosari indah tahap 2 blok mawar no 37 smraja kec medan amplas kel.', '3.545058,98.706860', 7, 1, 1, '', 3, '0', '', 7, 1, 7, 1, '', '', 1, '2020-12-07 05:24:23'),
(178, 'Aurora', '081376660608', 'jln harmonika baru no.110 pasar 1 padang bulan medan selayang 20135 ( depan J&M coffee). Menu: lunch + dinner weekely.', '3.555143,98.649645', 7, 3, 1, '-', 2, '395000', '', 7, 1, 7, 5, '', '-', 1, '2020-12-07 05:24:23'),
(179, 'Ernawati ', '081262142271', 'JL. PUTRI HIJAU NO.10 PINTU KELUAR JW MARRIOTT ( HALTE BUS PERINTIS KEMERDEKAAN )', '3.596612,98.675840', 7, 1, 1, 'Jangan pedas. Kurangi lada dan chilli flakes', 1, '175000', '', 7, 1, 7, 5, 'Pengiriman senin-selasa kekantor rabu skip kamis-jumat kerumah', '', 1, '2020-12-07 05:24:23'),
(180, 'Ira', '081370520550', 'Jl. abadi zilenia residence b8 .', '3.573246,98.629408', 7, 3, 1, '', 2, '335000', '02-12-2020', 7, 1, 9, 5, '-', '-', 1, '2020-12-07 05:24:23'),
(182, 'Ira', '081370520550', 'Jl. abadi zilenia residence b8 .', '3.573246,98.629408', 9, 4, 1, '', 3, '0', '', 7, 1, 10, 5, 'Skip tgl 9,24,25,26,27,31,1,2,3 desember', '-', 0, '2020-12-07 05:24:23'),
(183, 'Cut rini', '081375826083', 'Jl M. idris no 45B.', '3.596204,98.658964', 7, 1, 1, '', 1, '195000', '07-12-2020', 7, 1, 7, 5, '', '', 1, '2020-12-07 05:24:23'),
(184, 'Fitri', '08116124442', 'Jl M. idris No.45B', '3.596204,98.658964', 7, 2, 1, '', 1, '195000', '07-12-2020', 7, 1, 7, 5, '', '', 1, '2020-12-07 05:24:23'),
(185, 'Aldila hilma', '085261951500', 'Jl.M. Idris no 47', '3.596292,98.659113', 7, 3, 1, '', 1, '330000', '07-12-2020', 7, 1, 7, 5, 'Dinner sebelum jam 6. Intermitten fasting', '', 1, '2020-12-07 05:24:23'),
(186, 'Juliaty Ginting', '081361447314', 'jl pasar baru no 43 padang bulan', '3.552058,98.654967', 7, 3, 1, 'No Ayam, No Nasi merah, ASAM URAT (daging ayam, ikan, jamur TIDAK LEBIH 70 gram, kurangi biji2an, kacang2an, kol, dan bayam. HARAM Jeroan)', 3, '0', '', 7, 1, 7, 5, '', '', 1, '2020-12-07 05:24:23'),
(187, 'Clarissia', '08126038654', 'BCA Diponegoro', '3.584618,98.672817', 7, 1, 1, 'No Beef', 1, '200000', '07-12-2020', 7, 1, 7, 5, '-', '-', 1, '2020-12-07 05:24:23'),
(188, 'Cheria Dinner', '081262943669', '(Dinner) Jl. Puri Gg. K Alimun no 28/59B (masuk gang, mentok belok kiri)', '3.578560,98.688845', 7, 5, 1, 'NO BEEF', 1, '0', '', 6, 1, 9, 5, '', '-', 1, '2020-12-07 05:24:23'),
(189, 'Cheria Dinner', '081262943669', '(Dinner) Jl. Puri Gg. K Alimun no 28/59B (masuk gang, mentok belok kiri)', '3.578560,98.688845', 8, 5, 1, 'NO BEEF', 1, '0', '', 6, 1, 9, 1, '', '-', 1, '2020-12-07 05:24:23'),
(190, 'Cheria Dinner', '081262943669', '(Dinner) Jl. Puri Gg. K Alimun no 28/59B (masuk gang, mentok belok kiri)', '3.578560,98.688845', 9, 5, 1, 'NO BEEF', 1, '0', '', 6, 1, 9, 5, 'Skip tgl 9,24,25,26,27,31,1,2,3 desember', '-', 1, '2020-12-07 05:24:23'),
(191, 'Fifi', '087825567898', 'Jl.Kereta Api Baru No.10B ; Kesawan ; Medan Barat', '3.589103,98.680338', 7, 1, 1, '', 1, '395000', '', 7, 1, 8, 4, '', 'Pengiriman lewat pintu belakang, masuk dari gang di samping rumah Jl.Perniagaan Baru no. 20C', 1, '2020-12-07 05:24:23'),
(192, 'Debby anggraini', '08126000357', 'Jl. Karya Jaya No. 146', '3.529349,98.676531', 7, 3, 1, 'Hipertensi + HAMIL. Less salt, less magic, less kecap yang asin. WARNING! Kalo perlu yg lain ngikut yg ini daripada yg ini ngikut yg lain!    No udang', 1, '395000', '', 7, 1, 7, 5, '', '-', 1, '2020-12-07 05:24:23'),
(193, 'Nesya Ardella', '08113677431', 'Perumahan Medan Resort City (Mercy) Rotterdam blok K06 kec.Deli Tua', '3.512107,98.675058', 7, 3, 1, '', 2, '495000', '', 7, 1, 7, 5, '', '', 1, '2020-12-07 05:24:23'),
(194, 'Hasudungan', '085261684301', 'Jl. Kenangq sari No. 21 Pasae 6 Tj. Sari ', '3.561753,98.639911', 7, 1, 1, 'No udang,hipertensi', 1, '195000', '07-12-2020', 7, 2, 8, 1, '', '-', 1, '2020-12-07 06:59:23'),
(195, 'Hasudungan', '085261684301', 'Jl. Kenanga sari No. 21 Pasae 6 Tj. Sari', '3.561753,98.639911', 8, 1, 1, 'ALERGI UDANG. Hipertensi Less salt, less magic, less kecap yang asin, less mayo, less mentega. Kalo bisa HAMBAR aja', 1, '0', '', 7, 2, 8, 1, '', '-', 1, '2020-12-07 06:59:23'),
(196, 'Amerinda', '085261684301', 'Jl. Kenangq sari No. 21 Pasae 6 Tj. Sari ', '3.561753,98.639911', 7, 1, 1, '', 1, '220000', '07-12-2020', 7, 2, 8, 1, '', '-', 1, '2020-12-07 14:00:47'),
(197, 'Amerinda', '085261684301', 'Jl. Kenangq sari No. 21 Pasae 6 Tj. Sari ', '3.561753,98.639911', 8, 1, 1, '', 1, '0', '', 7, 2, 8, 1, '', '-', 1, '2020-12-07 14:00:47'),
(198, 'Nesya Ardella', '08113677431', 'Perumahan Medan Resort City (Mercy) Rotterdam blok K06 kec.Deli Tua', '3.512107,98.675058', 8, 3, 1, '', 3, '0', '', 7, 1, 9, 1, 'Mengganti hari rabu diganti di tgl 21', '', 1, '2020-12-10 05:18:38'),
(199, 'Debby anggraini', '08126000357', 'Jl. Karya Jaya No. 146', '3.529349,98.676531', 8, 3, 1, 'ALERGI UDANG. Hipertensi + HAMIL. Less salt, less magic, less kecap yang asin, Less mayo, less mentega. Kalo bisa HAMBAR aja', 1, '0', '', 7, 1, 8, 1, 'Mengganti hari rabu', '-', 1, '2020-12-10 05:19:30'),
(200, 'Fifi', '087825567898', 'Jl.Kereta Api Baru No.10B ; Kesawan ; Medan Barat', '3.589103,98.680338', 8, 1, 1, '', 1, '0', '', 7, 1, 8, 4, 'Tgl 11 skip diganti di tgl 18 jumat', 'Pengiriman lewat pintu belakang, masuk dari gang di samping rumah Jl.Perniagaan Baru no. 20C', 1, '2020-12-10 05:30:45'),
(201, 'Clarissia', '08126038654', 'BCA Diponegoro', '3.584618,98.672817', 8, 1, 1, 'No Beef', 1, '0', '', 7, 1, 8, 1, 'Ganti hari rabu', '-', 0, '2020-12-10 05:55:28'),
(202, 'Cheria Lunch', '081262943669', '(LUNCH) BCA ASIA SIMPANG LAMPUNG (samping bank UOB) jl. Asia no 184D titip satpam', '3.584527,98.691058', 8, 4, 1, 'NO BEEF', 2, '0', '', 6, 1, 10, 1, 'Selesai tgl 28 ganti hari rabu', '-LUNCH titip satpam. Harus sampe sebelum 11.45 !!', 1, '2020-12-10 05:57:17'),
(204, 'Juliaty Ginting', '081361447314', 'jl pasar baru no 43 padang bulan', '3.552058,98.654967', 8, 3, 1, 'No Ayam, No Nasi merah, ASAM URAT (daging ayam, ikan, jamur TIDAK LEBIH 70 gram, kurangi biji2an, kacang2an, kol, dan bayam. HARAM Jeroan)', 3, '0', '', 7, 1, 8, 1, 'Mengganti hari rabu', '', 0, '2020-12-10 05:58:46'),
(205, 'Aldila hilma', '085261951500', 'Jl.M. Idris no 47', '3.596292,98.659113', 8, 3, 1, '', 1, '0', '', 7, 1, 8, 2, 'Dinner sebelum jam 6. Intermitten fasting, jumat skip,selesai hari selasa', '', 1, '2020-12-10 05:59:54'),
(206, 'Cut rini', '081375826083', 'Jl M. idris no 45B.', '3.596204,98.658964', 8, 1, 1, '', 1, '0', '', 7, 1, 8, 1, 'Mengganti hari rabu', '', 0, '2020-12-10 06:00:44'),
(207, 'Ira', '081370520550', 'Jl. abadi zilenia residence b8 .', '3.573246,98.629408', 8, 1, 1, '', 3, '0', '', 7, 1, 8, 1, 'Mengganti hari rabu', '-', 0, '2020-12-10 06:01:52'),
(208, 'Ernawati ', '081262142271', 'JL. PUTRI HIJAU NO.10 PINTU KELUAR JW MARRIOTT ( HALTE BUS PERINTIS KEMERDEKAAN )', '3.596612,98.675840', 8, 1, 1, 'Jangan pedas. Kurangi lada dan chilli flakes', 3, '0', '', 7, 1, 8, 1, 'Ganti hari rabu', '', 0, '2020-12-10 06:04:22'),
(209, 'Aurora', '081376660608', 'jln harmonika baru no.110 pasar 1 padang bulan medan selayang 20135 ( depan J&M coffee). Menu: lunch + dinner weekely.', '3.555143,98.649645', 8, 3, 1, '-', 2, '0', '', 7, 1, 8, 1, 'Mengganti hari rabu', '-', 0, '2020-12-10 06:05:29'),
(210, 'Dr vira', '081377402344', 'Jl garu 2 villa harjosari indah tahap 2 blok mawar no 37 smraja kec medan amplas kel.', '3.545058,98.706860', 8, 1, 1, '', 3, '0', '', 7, 1, 8, 1, 'Ganti hari rabu', '', 0, '2020-12-10 06:07:16'),
(211, 'Sofie', '081362124060', 'Jl amaliun gg johar no 16', '3.575142,98.694893', 8, 1, 1, 'Nasi,pasta,spaghetti,kentang,dan karbo lain DIBAWAH 65gr', 1, '0', '', 7, 1, 8, 1, 'Ganti hari rabu', 'blok mawar no 36-37 smraja (rumah putih)', 0, '2020-12-10 06:10:19'),
(212, 'Silvina', '08163147074', 'BCA B&G tower (JW Mariot)', '3.596149,98.675886', 8, 1, 1, '', 1, '220000', '13-12-2020', 8, 1, 9, 1, 'Selesai tgl 21 ganti hari rabu', '', 1, '2020-12-10 06:10:51'),
(213, 'Winna kartika', '087869090150', 'Jl. Menteng VII gg. Kesatria no. 20 Medan', '3.566334,98.725043', 8, 1, 1, 'Nasi,pasta,spaghetti,kentang,dan karbo lain DIBAWAH 65gr. NO PEDAS', 1, '0', '', 7, 1, 8, 1, 'Ganti hari rabu', '', 0, '2020-12-10 06:11:27'),
(214, 'Eva', '085361045222', 'Jl. Rahmadsyah 416-C Medan (praktek dr.muzahar, sebelah gg sekolah)', '3.5794745, 98.6953237', 8, 3, 1, 'Hipertensi. Less salt, less magic, less kecap yang asin, less mayo, less mentega. Kalo bisa HAMBAR aja', 1, '0', '', 8, 1, 9, 1, 'Ganti hari rabu', '', 0, '2020-12-10 06:12:03'),
(215, 'Shintha', '08116298000', 'Kantor Garuda Indonesia Jl. Mongonsidi No. 34 A.', '3.571451,98.666901', 8, 1, 1, 'No nasi', 2, '0', '', 7, 1, 8, 1, 'Ganti hari rabu', '', 0, '2020-12-10 06:12:38'),
(216, 'Ika ', '085358941117', 'Jl Panglima Denai Menteng 7 Komplek The Grand Menteng Indah Cluster The Green No.8 b Medan', '3.5538551, 98.7235720', 8, 1, 1, 'NO NASI', 2, '0', '', 7, 1, 8, 1, 'Bayar ongkir ganti hari rabu', '-', 0, '2020-12-10 06:18:25'),
(217, 'Mardhiyah Harahap', '081261925277', 'Jl. Asrama, RS Hermina Medan, Sei Sikambing atau Jl. Asrama, Komplek Bumi Asrk No A16', '3.595367,98.627378', 8, 6, 1, 'Nasi,pasta,spaghetti,kentang,dan karbo lain DIBAWAH 65gr', 2, '0', '', 6, 3, 9, 3, 'Siap tanggal 23 mengganti hari rabu', '', 1, '2020-12-10 06:20:33'),
(218, 'Mardhiyah Harahap', '081261925277', 'Jl. Asrama, RS Hermina Medan, Sei Sikambing atau Jl. Asrama, Komplek Bumi Asrk No A16', '3.595367,98.627378', 9, 6, 1, 'DIET', 2, '0', '', 6, 3, 9, 3, 'Skip tgl 9 desember', '', 1, '2020-12-10 06:20:33'),
(219, 'Amelia', '08126522057', 'Tirta investama jl kapten soemarsono No 74', '3.615893,98.641688', 8, 2, 1, '', 1, '0', '', 6, 1, 8, 1, 'Ganti hari rabu', '', 0, '2020-12-10 06:35:48'),
(220, 'Elyana', '081973435336', 'Platinum garden katamso sebelah sekolah wr supratman Blok A17', '3.545625,98.687222', 8, 1, 1, 'NO NASI MERAH', 1, '0', '', 7, 1, 8, 1, 'Ganti hari rabu', '', 0, '2020-12-10 06:54:22'),
(223, 'Johan', '082366598888', 'Jl raden saleh dalam No.10', '3.589318,98.677325', 7, 3, 1, '', 1, '0', '', 6, 1, 9, 1, 'Selesai di tgl 28 ganti hari rabu', '-', 1, '2020-12-10 07:19:13'),
(227, 'Johan', '082366598888', 'Jl raden saleh dalam No.10', '3.589318,98.677325', 8, 3, 1, '', 1, '0', '', 6, 1, 10, 1, 'Selesai di tgl 28 ganti hari rabu', '-', 1, '2020-12-10 08:06:22'),
(228, 'Johan', '082366598888', 'Jl raden saleh dalam No.10', '3.589318,98.677325', 9, 3, 1, '', 1, '0', '', 6, 1, 9, 5, 'Skip tgl 9,24,25,26,27,31,1,2,3 desember', '-', 1, '2020-12-10 08:06:22'),
(230, 'Ola sembiring', '082273508719', 'Jl bunga asoka komplek asoka raya residance blok d57. Ringroad medan', '3.564046,98.622653', 7, 1, 1, 'ALERGI AYAM & UDANG. Nasi,pasta,spaghetti,kentang,dan karbo lain DIBAWAH 65gr', 2, '195000', '10-12-2020', 7, 5, 8, 4, '', '', 1, '2020-12-10 09:38:43'),
(231, 'Ola sembiring', '082273508719', 'Jl bunga asoka komplek asoka raya residance blok d57. Ringroad medan', '3.564046,98.622653', 8, 1, 1, 'ALERGI AYAM & UDANG. Nasi,pasta,spaghetti,kentang,dan karbo lain DIBAWAH 65gr', 2, '0', '', 7, 5, 8, 4, '', '', 1, '2020-12-10 09:38:43'),
(233, 'Dr.ratna', '082272625881', 'Jl pondok surya blok 1 no 13', '3.6113861, 98.6586129', 8, 1, 1, '', 3, '0', '', 8, 1, 8, 5, 'Endorse', '', 1, '2020-12-10 10:58:41'),
(234, 'Nabila', '081269638109', 'Jl bahagia No 50 sukaraja juanda', '3.571451,98.683794', 8, 1, 1, 'Maagh. No pedas, no asam, no minyak berlebih', 2, '195000', '', 8, 1, 8, 5, '', '', 1, '2020-12-10 11:21:49'),
(236, 'Willi', '082167888811', 'Jl s parman no 217, cambridge apartemen tower picasso lantai 21 (dari zainul arifin, pas sebelum tanjakan turun starbucks cambridge ada gerbang besi, drop off ke security sana saja).', '3.584218,98.667676', 9, 2, 1, 'NO BEEF & LESS SALT', 1, '0', '', 7, 1, 9, 1, 'Skip tgl 9 desember', '( dari zainul arifin, pas sebelum tanjakan turun starbucks cambridge ada gerbang besi, drop off ke security sana saja )', 0, '2020-12-10 11:33:39'),
(238, 'Fitri', '08116124442', 'Jl M. idris No.45B', '3.596204,98.658964', 8, 2, 1, '', 1, '0', '', 7, 1, 8, 1, 'Ganti hari rabu', '', 0, '2020-12-10 11:37:49'),
(242, 'dr. Novia', '08118955385', 'Oyo medan city homestay / turki family spa jln dr mansyur no 81.', '3.567458,98.647036', 7, 5, 1, 'SAYUR NYA MINTA DIBANYAKIN', 1, '795000', '12-12-2020', 7, 5, 10, 4, 'Skip16,24 desember', '-Harus SAMPE TANGAN sebelum 17.30.', 1, '2020-12-10 13:20:29'),
(243, 'dr. Novia', '08118955385', 'Oyo medan city homestay / turki family spa jln dr mansyur no 81.', '3.567458,98.647036', 8, 5, 1, 'SAYUR NYA MINTA DIBANYAKIN', 1, '0', '', 7, 5, 10, 4, 'Skip16,24,30 desember', '-Harus SAMPE TANGAN sebelum 17.30.', 1, '2020-12-10 13:20:29'),
(244, 'dr. Novia', '08118955385', 'Oyo medan city homestay / turki family spa jln dr mansyur no 81.', '3.567458,98.647036', 9, 5, 1, 'SAYUR NYA MINTA DIBANYAKIN', 1, '0', '', 7, 5, 11, 4, 'Skip16,24,25,26,27,30,31,1,2,3', '-Harus SAMPE TANGAN sebelum 17.30.', 1, '2020-12-10 13:20:29'),
(246, 'Devi Haslan', '082304195747', 'Jl. r.a kartini. no. 26 / Tamoe coffee and resto', '3.5800774, 98.6741466', 8, 1, 1, 'Alergi ikan', 1, '220000', '', 8, 1, 8, 5, '', '', 1, '2020-12-12 12:50:44'),
(247, 'Nesya Ardella', '08113677431', 'Perumahan Medan Resort City (Mercy) Rotterdam blok K06 kec.Deli Tua', '3.512107,98.675058', 9, 3, 1, '', 3, '0', '', 8, 1, 9, 1, 'Skip tgl 14d des', '', 0, '2020-12-13 02:48:11'),
(248, 'Amelia', '08126522057', 'Tirta investama jl kapten soemarsono No 74', '3.615893,98.641688', 8, 3, 1, '', 1, '395000', '', 8, 2, 9, 1, 'Dinner di kirim ke jalan kenanga sari No 17b', '', 1, '2020-12-13 12:56:01'),
(249, 'Amelia', '08126522057', 'Tirta investama jl kapten soemarsono No 74', '3.615893,98.641688', 9, 2, 1, '', 1, '0', '', 8, 2, 9, 1, 'Dinner di kirim ke jalan kenanga sari No 17b  skip 15 desember di ganti ditngl 4 januari', '', 1, '2020-12-13 12:56:01'),
(250, 'Riry batubara', '08116331290', 'Jl.suka damai ujung no.15, kel. sei agul, medan barat. (deket supermarket irian jalan karya)', '3.609607,98.666602', 8, 3, 2, 'Hipertensi dan jantung. Less salt, less magic, less kecap yang asin, less mayo, less mentega. Kalo bisa HAMBAR aja', 2, '180000', '13-12-2020', 8, 1, 8, 1, 'Cuma satu hari', 'Diantar sebelum jam 11.30', 1, '2020-12-13 13:13:36'),
(253, 'Hanifah ', '082165026264', 'Jl.Dr sumarsono No 16', '3.569542,98.657452', 8, 1, 1, '', 2, '195000', '13-12-2020', 8, 1, 8, 5, '', '', 1, '2020-12-13 13:16:08'),
(254, 'Eva', '085361045222', 'Jl. Rahmadsyah 416-C Medan (praktek dr.muzahar, sebelah gg sekolah)', '3.5794745, 98.6953237', 8, 3, 1, 'Hipertensi. Less salt, less magic, less kecap yang asin, less mayo, less mentega. Kalo bisa HAMBAR aja', 1, '395000', '13-12-2020', 8, 1, 8, 5, '', '', 1, '2020-12-13 14:07:02'),
(255, 'Muhammad Alles', '081233814292', 'Jl.suka bakti No 20', '3.545629,98.694317', 8, 1, 1, '', 2, '195000', '', 8, 1, 9, 2, 'Kamis jumat skip siap tanggal 22', '', 1, '2020-12-13 15:52:53'),
(256, 'Muhammad Alles', '081233814292', 'Jl.suka bakti No 20', '3.545629,98.694317', 9, 1, 1, '', 1, '0', '', 8, 1, 9, 2, 'Kamis jumat skip siap tanggal 22', '', 0, '2020-12-13 15:52:53'),
(257, 'Debby anggraini', '08126000357', 'Jl. Karya Jaya No. 146', '3.529349,98.676531', 8, 3, 2, 'ALERGI UDANG. Hipertensi + HAMIL. Less salt, less magic, less kecap yang asin, Less mayo, less mentega. Kalo bisa HAMBAR aja', 1, '711000', '15-12-2020', 8, 2, 8, 5, '', '-', 1, '2020-12-14 07:43:40'),
(258, 'Tanty anggraeni s', '081377060515', 'Polda sumut pintu 3', '3.530834,98.737646', 8, 1, 1, 'Nasi,pasta,spaghetti,kentang,dan karbo lain DIBAWAH 65gr', 2, '220000', '14-12-2020', 8, 1, 8, 5, '', '', 1, '2020-12-14 09:36:43');
INSERT INTO `catering_buyer` (`id`, `name`, `phone`, `address`, `latlong`, `order_batch_id`, `order_package_id`, `quantity`, `nutritional_needs`, `payment_to`, `payment_amount`, `payment_date`, `batch_start_id`, `day_start`, `batch_end_id`, `day_end`, `notes`, `driver_notes`, `is_active`, `created_time`) VALUES
(259, 'Elyana', '081973435336', 'Platinum garden katamso sebelah sekolah wr supratman Blok A17', '3.545625,98.687222', 8, 1, 1, 'NO NASI MERAH', 1, '220000', '14-12-2020', 8, 2, 9, 1, '', '', 1, '2020-12-14 13:56:23'),
(260, 'Elyana', '081973435336', 'Platinum garden katamso sebelah sekolah wr supratman Blok A17', '3.545625,98.687222', 9, 1, 1, 'NO NASI MERAH', 1, '0', '', 8, 2, 9, 1, '', '', 0, '2020-12-14 13:56:23'),
(261, 'Atika nst', '081370554407', 'Jl.sei bahorok gg mesjid No 20', '3.578541,98.654547', 8, 1, 1, 'Diet', 2, '195000', '', 8, 3, 9, 2, '', '', 1, '2020-12-14 15:34:38'),
(262, 'Lisda siregar', '082304694312', 'Jl.pabrik tenun No 92', '3.598892,98.656305', 8, 1, 1, 'Alergi ikan dan diet', 1, '195000', '15-12-2020', 8, 3, 9, 2, '', '', 1, '2020-12-15 07:59:32'),
(264, 'Fifi 2', '08196087171', 'PT.Asia sakti wah8d foods jl.pertahanan I No 7', '3,5383408, 98,7200040', 8, 1, 2, '', 1, '100000', '15-12-2020', 8, 5, 8, 5, '', '', 1, '2020-12-15 09:27:16'),
(265, 'Indah', '08116144477', 'Jln ampera 2 komp bank indonesia no 29 kel sei sikambing C mdn helvetia', '3.595008,98.630441', 8, 3, 1, '', 2, '395000', '15-12-2020', 8, 3, 9, 2, '', '', 1, '2020-12-15 13:14:03'),
(266, 'Indah', '08116144477', 'Jln ampera 2 komp bank indonesia no 29 kel sei sikambing C mdn helvetia', '3.595008,98.630441', 9, 3, 1, '', 2, '0', '', 8, 3, 9, 2, '', '', 0, '2020-12-15 13:14:03'),
(267, 'Rini mirza', '082280757879', 'Jl karya wisata komplek villa kencana no 34 b medan johor', '3.516988,98.658039', 9, 3, 1, 'HIPERTENSI TANPA OBAT', 2, '195000', '15-12-2020', 9, 1, 9, 3, 'Senin&rabu(lunch+dinner) selasa (lunch)', '', 1, '2020-12-15 15:34:20'),
(268, 'Jesica elisabet', '081260323211', 'Jl sei arakundo No 32', '3.587518,98.650646', 8, 3, 1, '', 2, '395000', '16-12-2020', 8, 4, 9, 3, '', '', 1, '2020-12-16 03:37:45'),
(269, 'Jesica elisabet', '081260323211', 'Jl sei arakundo No 32', '3.587518,98.650646', 9, 3, 1, '', 2, '0', '', 8, 4, 9, 3, '', '', 1, '2020-12-16 03:37:45'),
(270, 'Unun siregar', '08126034390', 'Gedung PT Bank Sumut. Lantai 6 Div Ops CLAK. Jl Imam Bonjol No 18 Medan', '3.583235,98.675070', 8, 1, 3, 'Alergi seafood dan diet', 1, '585000', '16-12-2020', 8, 4, 9, 3, '', '', 1, '2020-12-16 08:25:10'),
(271, 'Unun siregar', '08126034390', 'Gedung PT Bank Sumut. Lantai 6 Div Ops CLAK. Jl Imam Bonjol No 18 Medan', '3.583235,98.675070', 9, 1, 3, 'ALERGI SEAFOOD & DIET', 1, '0', '', 8, 4, 10, 2, 'Extend senen dan selasa', '', 1, '2020-12-16 08:25:10'),
(272, 'Anisa sartika', '082274938017', 'Jl Dr sumarsono No 4 (dibelakang RS USU)', '3.569560,98.658666', 8, 1, 1, '', 2, '156000', '16-12-2020', 8, 5, 9, 3, 'Hanya 4 hari', '', 1, '2020-12-16 10:57:22'),
(273, 'Anisa sartika', '082274938017', 'Jl Dr sumarsono No 4 (dibelakang RS USU)', '3.569560,98.658666', 9, 1, 1, '', 2, '0', '', 8, 5, 9, 3, 'Hanya 4 hari selasa dinner rabu lunch', '', 1, '2020-12-16 10:57:22'),
(274, 'Fajar 2', '6285270822552', 'Jl M.Idris No 45 B', '3.596204,98.658964', 8, 1, 1, '', 2, '0', '', 8, 4, 9, 3, '', '', 1, '2020-12-17 00:41:52'),
(275, 'Fajar 2', '6285270822552', 'Jl M.Idris No 5 B', '3.594258,98.658122', 9, 1, 1, '', 1, '195000', '04-01-2021', 8, 4, 9, 3, '', '', 1, '2020-12-17 00:41:52'),
(276, 'Fitri', '08116124442', 'Jl M. idris No.45B', '3.596204,98.658964', 8, 2, 1, '', 1, '0', '', 8, 4, 9, 3, '', '', 1, '2020-12-17 00:52:04'),
(277, 'Fitri', '08116124442', 'Jl M. idris No.45B', '3.596204,98.658964', 9, 2, 1, '', 1, '195000', '04-01-2021', 8, 4, 9, 3, '', '', 1, '2020-12-17 00:52:04'),
(278, 'Cut rini', '081375826083', 'Klinik Artdenta II . jln gagak hitam ringroad sebelah dokter hewan', '3.577964,98.626742', 8, 2, 1, '', 1, '0', '', 8, 4, 9, 3, '', '', 1, '2020-12-17 00:53:29'),
(279, 'Cut rini', '081375826083', 'Klinik Artdenta II . jln gagak hitam ringroad sebelah dokter hewan', '3.577979,98.626744', 9, 2, 1, '', 2, '195000', '02-01-2021', 8, 4, 9, 3, '', '', 1, '2020-12-17 00:53:29'),
(280, 'Fatma', '08116142115', 'Jl Catur No 17,Kelurahan pasar merah', '3,569393,98.694710', 9, 1, 1, 'DIET', 2, '195000', '17-12-2020', 9, 1, 9, 5, '', '', 1, '2020-12-17 14:30:23'),
(281, 'Syahrani', '082354321221', 'Jl.laksana no 5 imma kostsamping travel bombai dpan PDAM', '3.579271,98.691137', 8, 1, 1, '', 2, '195000', '17-12-2020', 8, 5, 9, 4, '', '', 1, '2020-12-17 15:23:24'),
(282, 'Syahrani', '082354321221', 'Jl.laksana no 5 imma kostsamping travel bombai dpan PDAM', '3.579271,98.691137', 9, 1, 1, '', 2, '0', '', 8, 5, 9, 4, '', '', 1, '2020-12-17 15:23:24'),
(283, 'Suma', '085361681729', 'Pantai timur jln. Karya no. 55 A kodam kampung lalang, Kel. cinta damai', '3.601013,98.613359', 9, 1, 1, '', 2, '220000', '19-12-2020', 9, 1, 9, 5, '', '', 1, '2020-12-19 04:27:24'),
(284, 'Nabila', '081269638109', 'Jl bahagia No 50 sukaraja juanda', '3.571451,98.683794', 9, 3, 1, 'MAAGH', 2, '395000', '19-12-2020', 9, 1, 9, 5, '', '', 1, '2020-12-19 04:28:35'),
(285, 'Jan fery sembiring', '085285681324', 'Hotel oyo angrek', '3.533112,98.622670', 9, 3, 1, 'ASAM URAT & ALERGI SEAFOOD', 2, '395000', '19-12-2020', 9, 1, 9, 5, '', '', 1, '2020-12-19 11:01:39'),
(286, 'Alfi siregar', '081269323422', 'Jl. Tridharma No. 148 USU', '3.557195,98.652489', 9, 1, 1, 'DIET', 2, '220000', '20-12-2020', 9, 1, 10, 3, 'Paket promo lunch', '', 1, '2020-12-20 05:23:31'),
(287, 'Alfi siregar', '081269323422', 'Jl. Tridharma No. 148 USU', '3.557195,98.652489', 10, 1, 1, 'Diet', 2, '0', '', 9, 1, 10, 3, 'Paket promo lunch', '', 1, '2020-12-20 05:23:31'),
(288, 'Frans lunch', '08126504803', 'Jl.S. Parman No. 261B/67 (Kantor Darmawan) .', '3.578310,98.666747', 9, 1, 1, '', 1, '395000', '20-12-2020', 9, 1, 10, 3, 'Paket promo lunch+dinner', '', 1, '2020-12-20 06:25:03'),
(289, 'Frans lunch', '08126504803', 'Jl.S. Parman No. 261B/67 (Kantor Darmawan) .', '3.578310,98.666747', 10, 3, 1, '', 1, '0', '', 9, 1, 10, 3, 'Paket promo lunch+dinner', '', 1, '2020-12-20 06:25:03'),
(290, 'Frans dinner', '08126504803', 'Jl Pancur Batu No. 18-F, daerag madong lubis, Sei Kera', '3.596541,98.691593', 9, 2, 1, '', 1, '0', '', 9, 1, 10, 3, 'Paket promo lunch+dinner', '', 1, '2020-12-20 06:32:15'),
(291, 'Frans dinner', '08126504803', 'Jl Pancur Batu No. 18-F, daerag madong lubis, Sei Kera', '3.596541,98.691593', 10, 2, 1, '', 1, '0', '', 9, 1, 10, 3, 'Paket promo lunch+dinner', '', 1, '2020-12-20 06:32:15'),
(292, 'Silvina', '08163147074', 'BCA B&G tower (JW Mariot)', '3.596149,98.675886', 9, 1, 1, '', 1, '220000', '', 9, 1, 10, 3, 'Paket promo lunch', '', 1, '2020-12-20 12:42:24'),
(293, 'Silvina', '081263147071', 'BCA B&G tower (JW Mariot)', '3.596149,98.675886', 10, 1, 1, '', 1, '0', '', 9, 1, 10, 3, 'Paket promo lunch', '', 1, '2020-12-20 12:42:24'),
(294, 'Devi Haslan', '082304195747', 'Jl. r.a kartini. no. 26 / Tamoe coffee and resto', '3.5800774, 98.6741466', 9, 1, 1, 'ALERGI IKAN', 1, '220000', '20-12-2020', 9, 1, 10, 3, 'Paket promo lunch tgl 23 skip', '', 1, '2020-12-20 12:43:02'),
(295, 'Devi Haslan', '082304195747', 'Jl. r.a kartini. no. 26 / Tamoe coffee and resto', '3.5800774, 98.6741466', 10, 1, 1, 'Alergi ikan', 1, '0', '', 9, 1, 11, 1, 'Paket promo lunch skip 18 des tgl 30 diganti ke dinner', '', 1, '2020-12-20 12:43:02'),
(296, 'Cheria Lunch', '081262943669', '(LUNCH) BCA ASIA SIMPANG LAMPUNG (samping bank UOB) jl. Asia no 184D titip satpam', '3.584527,98.691058', 9, 4, 1, 'NO BEEF', 2, '0', '', 6, 1, 9, 5, 'Skip tanggal 9,24,25,26,27,31,1,2,3desember', '-LUNCH titip satpam. Harus sampe sebelum 11.45 !!', 1, '2020-12-20 12:55:09'),
(298, 'Kiki meirina', '081269954501', 'Bank syariah mandiri KC Medan kampung baru jalan Brigjend Katamso No 717 AB.', '3.551787,98.688690', 9, 1, 1, '', 1, '220000', '20-12-2020', 9, 1, 10, 3, 'Paket promo lunch', '', 1, '2020-12-20 14:30:43'),
(299, 'Kiki meirina', '081269954501', 'Bank syariah mandiri KC Medan kampung baru jalan Brigjend Katamso No 717 AB.', '3.551787,98.688690', 10, 1, 1, '', 1, '0', '', 9, 1, 10, 3, 'Paket promo lunch', '', 1, '2020-12-20 14:30:43'),
(301, 'Sary munandar', '081368948863', 'Zania kos . Jln budi luhur .', '3.596136,98.632260', 10, 1, 1, '-', 2, '195000', '20-12-2020', 10, 1, 11, 2, 'Setiap H-1 dikirimi alamat', '', 1, '2020-12-20 16:47:10'),
(302, 'Sary munandar', '081368948863', 'Zania kost jln budi luhur', '3.596136,98.632260', 11, 1, 1, '-', 2, '0', '', 10, 1, 11, 2, 'Setiap H-1 dikirimi alamat', '', 0, '2020-12-20 16:47:10'),
(303, 'Nuril fitri', '082370046901', 'jl karya wisata komplek grand johor permai no A 11.', '3.517643,98.662122', 9, 3, 1, '', 1, '195000', '21-12-2020', 9, 1, 9, 3, 'Senin(dinner) selasa&rabu (lunch+dinner)', '', 1, '2020-12-21 03:19:26'),
(304, 'Atika nst', '081370554407', 'Jl.sei bahorok gg mesjid No 20', '3.578541,98.654547', 9, 1, 1, 'Diet', 1, '0', '', 8, 3, 9, 2, '', '', 0, '2020-12-21 05:43:15'),
(305, 'Dilla', '081376296007', 'JL... Mojopahit.. ujung.. No... 69.. A.. (Depan.. Yona.. Cafe)... Pagar.. htam.. yg.. ada.. ring.. basket... Medan.. 20153', '3.575552,98.665248', 10, 5, 1, 'Buah diganti Protein. HIGH PROTEIN & DIET', 2, '0', '', 7, 1, 11, 2, 'PAKAI.. MENU.. LUNCH skip tgl 9,24,25 desember tgl 30 ikt lunch+dinner', '(Depan.. Yona.. Cafe).. Pagar.. htam.. yg.. ada.. ring.. basket.. ', 1, '2020-12-22 07:32:41'),
(306, 'Dilla', '081376296007', 'JL... Mojopahit.. ujung.. No... 69.. A.. (Depan.. Yona.. Cafe)... Pagar.. htam.. yg.. ada.. ring.. basket... Medan.. 20153', '3.575552,98.665248', 11, 5, 1, 'HIGH PROTEIN & DIET BUAH DI GANTI PROTEIN', 2, '0', '', 7, 1, 11, 5, 'PAKAI.. MENU.. LUNCH skip tgl 9,24,25,31 desember 1 januari', '(Depan.. Yona.. Cafe).. Pagar.. htam.. yg.. ada.. ring.. basket.. ', 1, '2020-12-22 07:32:41'),
(307, 'Melsa pratiwi', '082260912490', 'Garuda indonesia jl mongonsidi No.34A depan hermes', '3.571363,98.666801', 10, 4, 1, 'NO NASI & ALERGI PEPAYA, NENAS, BUNCIS, NO PUMPKIN', 2, '0', '', 7, 1, 11, 4, 'Skip tgl 9,18,21,24,25,desember', '', 1, '2020-12-22 07:34:51'),
(308, 'Melsa pratiwi', '082260912490', 'Garuda indonesia jl mongonsidi No.34A depan hermes', '3.571363,98.666801', 11, 4, 1, 'NO NASI & ALERGI PEPAYA, NENAS, BUNCIS', 2, '0', '', 7, 1, 12, 2, 'Skip tgl 9,18,21,24,25,31desember 1 januari', '', 1, '2020-12-22 07:34:51'),
(309, 'Cheria Lunch', '081262943669', '(LUNCH) BCA ASIA SIMPANG LAMPUNG (samping bank UOB) jl. Asia no 184D titip satpam', '3.584527,98.691058', 10, 4, 1, 'NO BEEF', 2, '0', '', 6, 1, 10, 3, 'Skip tanggal 9,24,25,desember', '-LUNCH titip satpam. Harus sampe sebelum 11.45 !!', 1, '2020-12-22 07:42:17'),
(310, 'Cheria Dinner', '081262943669', '(Dinner) Jl. Puri Gg. K Alimun no 28/59B (masuk gang, mentok belok kiri)', '3.578560,98.688845', 10, 5, 1, 'NO BEEF', 1, '0', '', 6, 1, 10, 3, 'Skip tgl 9,24,25,desember', '-', 1, '2020-12-22 07:44:23'),
(311, 'Johan', '082366598888', 'Jl raden saleh dalam No.10', '3.589318,98.677325', 10, 3, 1, '', 1, '0', '', 6, 1, 10, 3, 'Skip tgl 9,24,25, desember', '-', 1, '2020-12-22 07:45:14'),
(312, 'dr. Novia', '08118955385', 'Oyo medan city homestay / turki family spa jln dr mansyur no 81.', '3.567458,98.647036', 10, 5, 1, 'SAYUR NYA MINTA DIBANYAKIN', 1, '0', '', 7, 5, 11, 4, 'Skip16,24,25,30,31,1,2,3  belum di tambah hari nya', '-Harus SAMPE TANGAN sebelum 17.30.', 1, '2020-12-22 07:48:05'),
(313, 'dr. Novia', '08118955385', 'Oyo medan city homestay / turki family spa jln dr mansyur no 81.', '3.567458,98.647036', 11, 5, 1, 'SAYUR NYA MINTA DIBANYAKIN', 1, '0', '', 7, 5, 12, 2, 'Skip16,24,25,30,31,1,6', '-Harus SAMPE TANGAN sebelum 17.30.', 1, '2020-12-22 07:48:05'),
(314, 'Fatma', '08116142115', 'Jl Catur No 17,Kelurahan pasar merah', '3,569393,98.694710', 10, 1, 1, 'DIET', 2, '0', '', 9, 1, 10, 2, 'Skip 24,25 desember', '', 0, '2020-12-22 07:49:29'),
(315, 'Syahrani', '082354321221', 'Jl.laksana no 5 imma kostsamping travel bombai dpan PDAM', '3.579271,98.691137', 10, 5, 1, '', 1, '795000', '28-12-2020', 10, 2, 13, 1, 'Skip tgl 31 des,1,januari belum ditambah hari', '', 1, '2020-12-22 07:51:11'),
(316, 'Suma', '085361681729', 'Pantai timur jln. Karya no. 55 A kodam kampung lalang, Kel. cinta damai', '3.601013,98.613359', 10, 1, 1, '', 2, '0', '', 9, 1, 10, 2, 'Skip 24,25 desember', '', 0, '2020-12-22 07:52:09'),
(317, 'Nabila', '081269638109', 'Jl bahagia No 50 sukaraja juanda', '3.571451,98.683794', 10, 3, 1, 'MAAGH', 2, '0', '', 9, 1, 10, 2, 'Skip tgl 24,25 desember', '', 0, '2020-12-22 07:53:13'),
(318, 'Jan fery sembiring', '085285681324', 'Hotel oyo angrek', '3.533112,98.622670', 10, 3, 1, 'ASAM URAT & ALERGI SEAFOOD', 2, '0', '', 9, 1, 10, 2, 'Skip tgl 24,25 desember', '', 0, '2020-12-22 07:53:55'),
(319, 'Unun siregar', '08126034390', 'Gedung PT Bank Sumut. Lantai 6 Div Ops CLAK. Jl Imam Bonjol No 18 Medan', '3.583235,98.675070', 10, 1, 3, 'ALERGI SEAFOOD & DIET', 1, '0', '', 8, 4, 10, 2, 'Extend senen dan selasa', '', 0, '2020-12-22 07:54:58'),
(321, 'Linda siregar', '082304694312', 'Jl.pabrik tenun No 92', '3.598892,98.656305', 9, 1, 1, 'ALERGI IKAN DAN DIET', 1, '0', '', 8, 3, 9, 2, '', '', 0, '2020-12-22 13:01:03'),
(322, 'Sri M Wahyuningtias', '082274547529', 'Jl stm sukajaya no 6  kel sukamaju.', '3.545559,98.690890', 10, 3, 1, 'Hipertensi + Diabetes', 1, '150000', '25-12-2020', 10, 1, 10, 3, 'Hanya 3 hari', '', 1, '2020-12-25 13:37:39'),
(323, 'Lina taslim', '081932000844', 'Jl. Cemara ujung 2a-2b medan', '3.628929,98.707356', 10, 3, 1, 'Diet', 1, '150000', '26-12-2020', 10, 1, 10, 3, 'Cmn 3 hari tambahan dinner selasa rabu tf 100k ke hanif', 'toko bangunan sumber rezeki depan spbu haji anif cemara asri.', 1, '2020-12-26 05:19:58'),
(324, 'Mardhiyah Harahap', '081261925277', 'Jl. Asrama, RS Hermina Medan, Sei Sikambing atau Jl. Asrama, Komplek Bumi Asrk No A16', '3.595367,98.627378', 10, 1, 1, 'DIET', 2, '0', '', 6, 3, 10, 1, 'Extend 1 hari', '', 0, '2020-12-27 15:25:41'),
(325, 'Vivi misdia', '08116060026', 'jl arifin no 1B Sitirejo II.', '3.552477,98.691760', 10, 1, 1, '', 1, '150000', '28-12-2020', 10, 1, 10, 3, '3 hari', '', 1, '2020-12-27 17:31:37'),
(326, 'Aldila hilma', '085261951500', 'Jl.M. Idris no 47', '3.596292,98.659113', 10, 3, 1, '', 1, '0', '', 10, 1, 11, 2, 'Start diiner tgl 28 lunch 29 selesai dinner tgl 5 lunch tgl 6', 'Dinner sebelum jam 6', 1, '2020-12-28 04:25:21'),
(327, 'Aldila hilma', '085261951500', 'Jl.M. Idris no 47', '3.596292,98.659113', 11, 3, 1, '', 1, '0', '', 10, 1, 11, 2, 'Start diiner tgl 28 lunch 29 selesai dinner tgl 5 lunch tgl 6', 'Dinner sebelum jam 6', 0, '2020-12-28 04:25:21'),
(328, 'Sri M Wahyuningtias', '082274547529', 'Jl stm sukajaya no 6  kel sukamaju.', '3.545559,98.690890', 11, 3, 1, 'Hipertensi + Diabetes', 1, '0', '', 11, 1, 11, 1, 'tambahan 1 hari saja ', '', 0, '2020-12-29 09:58:08'),
(329, 'Astri', '081263055747', 'Jl.karya wisata No 135', '3,5245607, 98,6630614', 11, 3, 1, '', 1, '0', '', 11, 1, 11, 5, '', 'Toko ASTRI', 1, '2020-12-30 03:27:59'),
(331, 'Devi Haslan', '082304195747', 'Jl. r.a kartini. no. 26 / Tamoe coffee and resto', '3.5800774, 98.6741466', 11, 3, 1, 'Alergi ikan', 1, '220000', '03-01-2021', 11, 1, 11, 5, 'Senin&selasa dinner kamis lunch+dinner jumat lunch', '', 1, '2021-01-03 15:37:25'),
(332, 'Amelia', '08126522057', 'Tirta investama jl kapten soemarsono No 74', '3.615893,98.641688', 11, 3, 1, '', 1, '0', '', 11, 1, 11, 1, 'Dinner di kirim ke jalan kenanga sari No 17b  cmn 1 hari', '', 0, '2021-01-03 15:38:21'),
(333, 'Silvina', '081263147071', 'BCA B&G tower (JW Mariot)', '3.596149,98.675886', 11, 4, 1, '', 1, '795000', '03-01-2021', 11, 1, 14, 5, '', '', 1, '2021-01-03 15:40:15'),
(334, 'Silvina', '081263147071', 'BCA B&G tower (JW Mariot)', '3.596149,98.675886', 12, 4, 1, '', 1, '795000', '03-01-2021', 11, 1, 13, 5, '', '', 1, '2021-01-03 15:40:15'),
(335, 'Silvina', '081263147071', 'BCA B&G tower (JW Mariot)', '3.596149,98.675886', 13, 4, 1, '', 1, '795000', '03-01-2021', 11, 1, 13, 5, '', '', 1, '2021-01-03 15:40:15'),
(336, 'Rini mirza', '082280757879', 'Jl karya wisata komplek villa kencana no 34 b medan johor', '3.516988,98.658039', 11, 2, 1, 'HIPERTENSI TANPA OBAT', 2, '220000', '03-01-2021', 11, 1, 12, 5, '2 minggu tgl 7,8 skip', '', 1, '2021-01-03 15:42:09'),
(337, 'Rini mirza', '082280757879', 'Jl karya wisata komplek villa kencana no 34 b medan johor', '3.516988,98.658039', 12, 2, 1, 'HIPERTENSI TANPA OBAT request pedas', 2, '0', '03-01-2021', 11, 1, 12, 2, '', '', 0, '2021-01-03 15:42:09'),
(338, 'Syahrani', '082354321221', 'Jl.laksana no 5 imma kostsamping travel bombai dpan PDAM', '3.579271,98.691137', 11, 5, 1, '', 1, '0', '', 10, 2, 13, 3, 'Skip tgl 31 des,1,januari', '', 1, '2021-01-03 16:11:00'),
(339, 'Syahrani', '082354321221', 'Jl.laksana no 5 imma kostsamping travel bombai dpan PDAM', '3.579271,98.691137', 12, 5, 1, '', 1, '0', '', 10, 2, 14, 3, 'Skip tgl 31 des,1,januari', '', 1, '2021-01-03 16:11:00'),
(340, 'Syahrani', '082354321221', 'Jl.laksana no 5 imma kostsamping travel bombai dpan PDAM', '3.579271,98.691137', 13, 5, 1, '', 1, '0', '', 10, 2, 13, 1, 'Skip tgl 31 des,1,januari belum ditambah hari', '', 1, '2021-01-03 16:11:00'),
(341, 'Debby anggraini', '08126000357', 'Jl. Karya Jaya No. 146', '3.529349,98.676531', 11, 3, 2, 'ALERGI UDANG. Hipertensi + HAMIL. Less salt, less magic, less kecap yang asin, Less mayo, less mentega. Kalo bisa HAMBAR aja', 1, '711000', '', 11, 1, 11, 5, 'Tambahan 1 lunch+dinner dari selasa sampe jumat', '-', 1, '2021-01-04 00:50:09'),
(342, 'Elyana', '081973435336', 'Platinum garden katamso sebelah sekolah wr supratman Blok A17', '3.545625,98.687222', 11, 1, 1, 'NO NASI MERAH', 1, '220000', '04-01-2021', 11, 2, 12, 1, '', '', 1, '2021-01-04 13:45:57'),
(343, 'Elyana', '081973435336', 'Platinum garden katamso sebelah sekolah wr supratman Blok A17', '3.545625,98.687222', 12, 1, 1, 'NO NASI MERAH', 1, '220000', '04-01-2021', 11, 2, 12, 1, '', '', 0, '2021-01-04 13:45:57'),
(344, 'Nesya Ardella', '08113677431', '', '0', 11, 3, 1, '', 2, '220000', '05-01-2021', 11, 2, 11, 4, 'Tambahan 1 hari tgl 7 januari dan alamat dikirim sebelum jam 9', '', 1, '2021-01-04 13:55:47'),
(345, 'Titin agustina', '082363422184', 'Lab.klinik prodia. Jl.S Parman no 223FG', '3.583152,98.667407', 11, 1, 2, '', 2, '390000', '05-01-2021', 11, 2, 12, 1, '', '', 1, '2021-01-05 00:57:11'),
(346, 'Titin agustina', '082363422184', 'Lab.klinik prodia. Jl.S Parman no 223FG', '3.583152,98.667407', 12, 1, 2, '', 2, '0', '', 11, 2, 12, 1, '', '', 0, '2021-01-05 00:57:11'),
(347, 'Cut yunita', '081361713409', 'wahid hasyim no 14( dinas ketenagakerjaan)', '3.5758622,98.6575172', 11, 3, 1, 'Diet', 1, '395000', '06-12-2002', 11, 3, 12, 2, 'Rabu dan kamis lunch di wahid hasyim no 14( dinas ketenagakerjaan).Jumat lunch n diner n rabu. Kamis  diner di komp tasbj 1 blok RR no 22', '', 1, '2021-01-05 08:45:40'),
(348, 'Cut yunita', '081361713409', 'wahid hasyim no 14( dinas ketenagakerjaan)', '3.5758622, 98.6575172', 12, 3, 1, 'Diet', 1, '0', '', 11, 3, 12, 2, 'Rabu dan kamis lunch di wahid hasyim no 14( dinas ketenagakerjaan). Jumat lunch n diner n rabu. Kamis  diner di komp tasbj 1 blok RR no 22', '', 0, '2021-01-05 08:45:40'),
(349, 'Lina taslim', '081932000844', 'Jl Sunkiss no 8f perum. Cemara asir', '3,6347744, 98,7050225', 11, 1, 1, 'Diet', 1, '45000', '05-01-2021', 11, 3, 11, 3, 'Cuma 1 hari', '', 1, '2021-01-05 13:49:17'),
(350, 'Dr tasya', '0', 'jalan karya wisata komplek ruko j city blok D50-51 (Glanz Clinic)', '3,5355081, 98,6625782', 11, 1, 1, '', 3, '0', '', 11, 4, 12, 3, 'Endorse', '', 1, '2021-01-06 06:26:16'),
(351, 'Dr tasya', '0', 'jalan karya wisata komplek ruko j city blok D50-51 (Glanz Clinic)', '3.5355081, 98.6625782', 12, 1, 1, '', 3, '0', '', 11, 4, 12, 3, 'Endorse', '', 1, '2021-01-06 06:26:16'),
(352, 'Sri M Wahyuningtias', '082274547529', 'Jl stm sukajaya no 6  kel sukamaju.', '3.545559,98.690890', 12, 6, 1, 'Diabetes', 2, '1450000', '08-01-2021', 12, 1, 15, 5, '', '', 1, '2021-01-08 09:25:38'),
(353, 'Sri M Wahyuningtias', '082274547529', 'Jl stm sukajaya no 6  kel sukamaju.', '3.545559,98.690890', 13, 6, 1, 'Hipertensi', 2, '1450000', '08-01-2021', 12, 1, 15, 5, '', '', 1, '2021-01-08 09:25:38'),
(354, 'Sri M Wahyuningtias', '082274547529', 'Jl stm sukajaya no 6  kel sukamaju.', '3.545559,98.690890', 14, 6, 1, 'Hipertensi', 2, '1450000', '08-01-2021', 12, 1, 15, 5, '', '', 1, '2021-01-08 09:25:38'),
(355, 'Sri M Wahyuningtias', '082274547529', 'Jl stm sukajaya no 6  kel sukamaju.', '3.545559,98.690890', 15, 6, 1, 'Hipertensi', 2, '1450000', '08-01-2021', 12, 1, 15, 5, '', '', 1, '2021-01-08 09:25:38'),
(356, 'Purwanti permata sari', '082273575742', 'Jl karya wisata, komp jcity (jcrown) blok a no.19-21', '3.5345654, 98.6603218', 12, 1, 1, '', 1, '195000', '08-01-2021', 12, 1, 12, 5, '', '', 1, '2021-01-08 10:25:32'),
(357, 'dr. Novia', '08118955385', 'Oyo medan city homestay / turki family spa jln dr mansyur no 81.', '3.567458,98.647036', 12, 5, 1, 'SAYUR NYA MINTA DIBANYAKIN', 1, '0', '', 7, 5, 12, 2, 'Skip16,24,25,30,31,1,6', '-Harus SAMPE TANGAN sebelum 17.30.', 1, '2021-01-10 03:34:21'),
(358, 'Grace', '082167578899', 'Jl supeno 8A', '3.5728727, 98.6729399', 12, 2, 1, 'No beef', 2, '195000', '10-01-2021', 12, 1, 12, 5, '', '', 1, '2021-01-10 14:25:25'),
(359, 'Devi Haslan', '082304195747', 'Jl. r.a kartini. no. 26 / Tamoe coffee and resto', '3.5800774, 98.6741466', 12, 3, 1, 'Alergi ikan', 1, '220000', '10-01-2021', 12, 1, 12, 5, 'Senin&selasa dinner kamis lunch+dinner jumat lunch', '', 1, '2021-01-10 14:27:19'),
(360, 'Clarissia', '08126038654', 'BCA Diponegoro', '3.584618,98.672817', 12, 1, 1, 'No Beef', 1, '0', '', 12, 1, 12, 5, '', '-', 1, '2021-01-10 14:28:12'),
(361, 'Elly siska', '0', 'BCA Diponegoro', '3.584618,98.672817', 12, 1, 1, 'No beef', 1, '0', '', 12, 1, 12, 5, '', '', 1, '2021-01-10 14:32:20'),
(362, 'Debby anggraini', '08126000357', 'Jl. Karya Jaya No. 146', '3.529349,98.676531', 12, 3, 1, 'ALERGI UDANG DAN SALMON. Hipertensi + HAMIL. Less salt, less magic, less kecap yang asin, Less mayo, less mentega. Kalo bisa HAMBAR aja', 1, '395000', '', 12, 1, 12, 5, '', '-', 1, '2021-01-10 16:14:20'),
(363, 'Melsa pratiwi', '082260912490', 'Garuda indonesia jl mongonsidi No.34A depan hermes', '3.571363,98.666801', 12, 4, 1, 'NO NASI & ALERGI PEPAYA, NENAS, BUNCIS', 2, '0', '', 7, 1, 12, 3, 'Skip tgl 9,18,21,24,25,31desember 1,12 januari', '', 1, '2021-01-10 16:24:49'),
(364, 'Dilla', '081376296007', 'JL... Mojopahit.. ujung.. No... 69.. A.. (Depan.. Yona.. Cafe)... Pagar.. htam.. yg.. ada.. ring.. basket... Medan.. 20153', '3.575552,98.665248', 12, 5, 1, 'HIGH PROTEIN & DIET BUAH DI GANTI PROTEIN', 2, '795000', '', 12, 1, 15, 5, 'PAKAI.. MENU.. LUNCH', '(Depan.. Yona.. Cafe).. Pagar.. htam.. yg.. ada.. ring.. basket.. ', 1, '2021-01-11 06:02:37'),
(365, 'Dilla', '081376296007', 'JL... Mojopahit.. ujung.. No... 69.. A.. (Depan.. Yona.. Cafe)... Pagar.. htam.. yg.. ada.. ring.. basket... Medan.. 20153', '3.575552,98.665248', 13, 5, 1, 'HIGH PROTEIN & DIET BUAH DI GANTI PROTEIN', 2, '0', '', 12, 1, 15, 5, 'PAKAI.. MENU.. LUNCH skip tgl 9,24,25,31 desember 1 januari', '(Depan.. Yona.. Cafe).. Pagar.. htam.. yg.. ada.. ring.. basket.. ', 1, '2021-01-11 06:02:37'),
(366, 'Dilla', '081376296007', 'JL... Mojopahit.. ujung.. No... 69.. A.. (Depan.. Yona.. Cafe)... Pagar.. htam.. yg.. ada.. ring.. basket... Medan.. 20153', '3.575552,98.665248', 14, 5, 1, 'HIGH PROTEIN & DIET BUAH DI GANTI PROTEIN', 2, '0', '', 12, 1, 15, 5, 'PAKAI.. MENU.. LUNCH skip tgl 9,24,25,31 desember 1 januari', '(Depan.. Yona.. Cafe).. Pagar.. htam.. yg.. ada.. ring.. basket.. ', 1, '2021-01-11 06:02:37'),
(367, 'Dilla', '081376296007', 'JL... Mojopahit.. ujung.. No... 69.. A.. (Depan.. Yona.. Cafe)... Pagar.. htam.. yg.. ada.. ring.. basket... Medan.. 20153', '3.575552,98.665248', 15, 5, 1, 'HIGH PROTEIN & DIET BUAH DI GANTI PROTEIN', 2, '0', '', 12, 1, 15, 5, 'PAKAI.. MENU.. LUNCH skip tgl 9,24,25,31 desember 1 januari', '(Depan.. Yona.. Cafe).. Pagar.. htam.. yg.. ada.. ring.. basket.. ', 1, '2021-01-11 06:02:37'),
(369, 'Nesya Ardella', '08113677431', 'Perumahan Medan Resort City (Mercy) Rotterdam blok K06 kec.Deli Tua', '3.512107,98.675058', 12, 2, 1, 'No pedas', 2, '55000', '', 12, 1, 12, 1, '', '', 0, '2021-01-11 10:21:38'),
(370, 'Nomi Mutiaridha', '082167677814', 'Jl Sei Kapuas no 11 Medan', '3.5838797, 98.6504406', 12, 3, 1, '', 1, '0', '', 12, 3, 13, 2, '', '', 1, '2021-01-12 11:07:40'),
(371, 'Nomi Mutiaridha', '082167677814', 'Jl Sei Kapuas no 11 Medan', '3,5838797, 98,6504406', 13, 3, 1, '', 1, '0', '', 12, 3, 13, 2, '', '', 1, '2021-01-12 11:07:40'),
(372, 'Rini mirza', '082280757879', 'Jl karya wisata komplek villa kencana no 34 b medan johor', '3.516988,98.658039', 12, 2, 1, 'HIPERTENSI TANPA OBAT request pedas', 2, '175000', '', 11, 3, 12, 2, '', '', 1, '2021-01-12 11:13:58'),
(373, 'dr. Novia', '08118955385', 'Oyo medan city homestay / turki family spa jln dr mansyur no 81.', '3.567458,98.647036', 12, 5, 1, 'SAYUR NYA MINTA DIBANYAKIN', 1, '0', '', 12, 3, 16, 2, 'Skip15,19,28 januari', '-Harus SAMPE TANGAN sebelum 17.30.', 1, '2021-01-13 03:50:21'),
(374, 'dr. Novia', '08118955385', 'Oyo medan city homestay / turki family spa jln dr mansyur no 81.', '3.567458,98.647036', 13, 5, 1, 'SAYUR NYA MINTA DIBANYAKIN', 1, '0', '', 12, 3, 16, 2, 'Skip15,19,28 januari', '-Harus SAMPE TANGAN sebelum 17.30.', 1, '2021-01-13 03:50:21'),
(375, 'dr. Novia', '08118955385', 'Oyo medan city homestay / turki family spa jln dr mansyur no 81.', '3.567458,98.647036', 14, 5, 1, 'SAYUR NYA MINTA DIBANYAKIN', 1, '0', '', 12, 3, 16, 2, 'Skip15,19,28 januari', '-Harus SAMPE TANGAN sebelum 17.30.', 1, '2021-01-13 03:50:21'),
(376, 'dr. Novia', '08118955385', 'Oyo medan city homestay / turki family spa jln dr mansyur no 81.', '3.567458,98.647036', 15, 5, 1, 'SAYUR NYA MINTA DIBANYAKIN', 1, '0', '', 12, 3, 16, 2, 'Skip15,19,28 januari', '-Harus SAMPE TANGAN sebelum 17.30.', 1, '2021-01-13 03:50:21'),
(377, 'dr. Novia', '08118955385', 'Oyo medan city homestay / turki family spa jln dr mansyur no 81.', '3.567458,98.647036', 16, 5, 1, 'SAYUR NYA MINTA DIBANYAKIN', 1, '0', '', 12, 3, 16, 2, 'Skip15,19,28 januari', '-Harus SAMPE TANGAN sebelum 17.30.', 1, '2021-01-13 03:50:21'),
(378, 'Cut yunita', '081361713409', 'Komplek tasbi 1 blok RR no 22', '3.5690292,98.6303820', 12, 2, 1, '', 1, '0', '', 12, 4, 13, 3, '', '', 0, '2021-01-13 10:51:35'),
(379, 'Cut yunita', '081361713409', 'Komplek tasbi 1 blok RR no 22', '3.5690292,98.6303820', 13, 2, 1, '', 1, '0', '', 12, 4, 13, 3, '', '', 1, '2021-01-13 10:51:35'),
(380, 'Yuyun ', '081361713409', 'Tasbi RR no 22', '3.5690292,98.6303820', 12, 2, 1, '', 1, '195000', '14-01-2021', 12, 4, 13, 3, '', '', 1, '2021-01-14 03:25:14'),
(381, 'Yuyun ', '081361713409', 'Tasbi RR no 22', '3.5690292,98.6303820', 13, 2, 1, '', 1, '195000', '14-01-2021', 12, 4, 13, 3, '', '', 1, '2021-01-14 03:25:14'),
(382, 'Kiki 2', '081397675533', 'Jl kapten sumarsono no 86 (global autocar doorsmeer) Helvetia medan.', '3,6157993, 98,6446879', 13, 2, 1, 'DIET', 1, '0', '', 13, 1, 13, 5, '', '', 1, '2021-01-14 08:42:57');

-- --------------------------------------------------------

--
-- Struktur dari tabel `catering_order_batch`
--

CREATE TABLE `catering_order_batch` (
  `id` int(11) NOT NULL,
  `name` varchar(20) NOT NULL,
  `batch_number` int(11) DEFAULT NULL,
  `duration` varchar(35) DEFAULT NULL,
  `is_active` tinyint(1) NOT NULL DEFAULT '1',
  `created_time` timestamp NOT NULL DEFAULT CURRENT_TIMESTAMP
) ENGINE=InnoDB DEFAULT CHARSET=latin1;

--
-- Dumping data untuk tabel `catering_order_batch`
--

INSERT INTO `catering_order_batch` (`id`, `name`, `batch_number`, `duration`, `is_active`, `created_time`) VALUES
(1, 'Batch 28', 28, '26-30 Oktober', 1, '2020-10-27 08:50:53'),
(2, 'Batch 29', 29, '2-6 November', 1, '2020-10-27 13:10:34'),
(3, 'Batch 30', 30, '9 - 13 November 2020', 1, '2020-10-30 23:53:36'),
(4, 'Batch 31', 31, '16 - 20 November 2020', 1, '2020-10-30 23:54:12'),
(5, 'Batch 32', 32, '23 - 27 November 2020', 1, '2020-10-31 12:48:56'),
(6, 'Batch 33', 33, '30 Nov - 4 Des 2020', 1, '2020-11-04 15:55:41'),
(7, 'Batch 34', 34, '7 - 12 Desember', 1, '2020-11-09 21:57:37'),
(8, 'Batch 35', 35, '14 - 18 Desember 2020', 1, '2020-11-29 17:18:43'),
(9, 'Batch 36', 36, '21 - 25 Desember 2020', 1, '2020-11-29 17:19:12'),
(10, 'Batch 37', 37, '28 Des 2020 - 1 Jan 2021', 1, '2020-12-06 17:14:05'),
(11, 'Batch 38', 38, '4 - 8 Januari 2021', 1, '2020-12-13 22:26:00'),
(12, 'Batch 39', 39, '11 - 15 Januari 2020', 1, '2020-12-13 22:30:07'),
(13, 'Batch 40', 40, '18 - 22 Januari 2020', 1, '2020-12-13 22:44:05'),
(14, 'Batch 41', 41, '25-29 Januari 2021', 1, '2021-01-08 03:48:24'),
(15, 'Batch 42', 42, '1-5 januari 2021', 1, '2021-01-08 04:06:31'),
(16, 'Batch 43', 43, '8-12 feb 2021', 1, '2021-01-11 06:01:46');

-- --------------------------------------------------------

--
-- Struktur dari tabel `catering_order_detail`
--

CREATE TABLE `catering_order_detail` (
  `id` int(11) NOT NULL,
  `catering_order_batch_id` int(11) NOT NULL,
  `day_id` int(11) NOT NULL,
  `time_order` int(11) NOT NULL,
  `buyer_id` int(11) NOT NULL,
  `address` longtext,
  `latlong` varchar(30) DEFAULT NULL,
  `notes` longtext,
  `driver_notes` longtext,
  `is_out_of_range` tinyint(1) DEFAULT '0',
  `is_active` tinyint(1) NOT NULL DEFAULT '1',
  `created_time` timestamp NOT NULL DEFAULT CURRENT_TIMESTAMP
) ENGINE=InnoDB DEFAULT CHARSET=latin1;

--
-- Dumping data untuk tabel `catering_order_detail`
--

INSERT INTO `catering_order_detail` (`id`, `catering_order_batch_id`, `day_id`, `time_order`, `buyer_id`, `address`, `latlong`, `notes`, `driver_notes`, `is_out_of_range`, `is_active`, `created_time`) VALUES
(37, 1, 1, 1, 8, 'Jl. Raden Saleh Dalam No. 10', '3.589529, 98.677090', '-', '-', 0, 1, '2020-10-28 17:01:42'),
(38, 1, 1, 1, 9, 'BCA KCP ASIA', '3.584493, 98.691076', '-', '-', 0, 1, '2020-10-28 17:01:49'),
(39, 1, 1, 1, 10, 'BCA JW', '3.596260, 98.676106', '-', '-', 0, 1, '2020-10-28 17:01:55'),
(46, 2, 1, 1, 15, 'Jl.Bunga Ester No.64d Psr VI P.Bulan (rumahnya pas di depan gereja katolik St.Fransiskus)', '3.544960, 98.651088', '-', '-', 0, 1, '2020-10-30 02:54:24'),
(47, 2, 1, 2, 15, 'Jl.Bunga Ester No.64d Psr VI P.Bulan (rumahnya pas di depan gereja katolik St.Fransiskus)', '3.544960, 98.651088', '-', '-', 0, 1, '2020-10-30 02:55:13'),
(48, 2, 2, 1, 15, 'Jl.Bunga Ester No.64d Psr VI P.Bulan (rumahnya pas di depan gereja katolik St.Fransiskus)', '3.544960, 98.651088', '-', '-', 0, 1, '2020-10-30 02:55:27'),
(53, 2, 4, 1, 15, 'Jl.Bunga Ester No.64d Psr VI P.Bulan (rumahnya pas di depan gereja katolik St.Fransiskus)', '3.544960, 98.651088', '-', '-', 0, 1, '2020-10-30 02:57:28'),
(54, 2, 4, 2, 15, 'Jl.Bunga Ester No.64d Psr VI P.Bulan (rumahnya pas di depan gereja katolik St.Fransiskus)', '3.544960, 98.651088', '-', '-', 0, 1, '2020-10-30 02:57:42'),
(56, 2, 3, 2, 14, 'Jl. Karya sehati no. 24', '3.530639, 98.671111', 'Diabetes dan asam urat. Nasi max 100 gr, daging2an max 60 gr', '-', 0, 1, '2020-10-30 03:01:39'),
(57, 2, 4, 2, 14, 'Jl. Karya sehati no. 24', '3.530639, 98.671111', 'Diabetes dan asam urat. Nasi max 100 gr, daging2an max 60 gr', '-', 0, 1, '2020-10-30 03:02:00'),
(59, 2, 1, 1, 16, 'Jl. Emas no. 18/30, sei rengas II', '3.5847916, 98.6976904', '-', '-', 0, 1, '2020-10-30 03:04:09'),
(60, 2, 1, 1, 17, 'Jl. Karya Jaya No. 146', '3.5301298, 98.6776335', 'LESS SALT, LESS MAGIC', '-', 0, 1, '2020-10-30 03:05:16'),
(61, 2, 1, 2, 17, 'Jl. Karya Jaya No. 146', '3.5301298, 98.6776335', 'Less salt, less magic', '-', 0, 1, '2020-10-30 03:05:49'),
(62, 2, 1, 1, 19, '(LUNCH) BCA ASIA SIMPANG LAMPUNG (samping bank UOB) jl. Asia no 184D titip satpam', '3.584527,98.691058', 'LUNCH titip satpam. Dinner ke jl. Puri.', '-', 0, 1, '2020-10-30 03:06:11'),
(63, 2, 1, 2, 20, '(Dinner) Jl. Puri Gg. K Alimun no 28/59B (masuk gang, mentok belok kiri)', '3.578560,98.688845', '-', '-', 0, 1, '2020-10-30 03:06:27'),
(64, 2, 1, 1, 21, 'Alamat Pengiriman:jl flamboyan raya,kompleks taman asoka asri blok E no 21', '3.5487250, 98.6173930', 'Diabetes jangan banyak kecap dan gula. Max 3 sendok', '-', 0, 1, '2020-10-30 03:07:43'),
(65, 2, 1, 2, 21, 'Alamat Pengiriman:jl flamboyan raya,kompleks taman asoka asri blok E no 21', '3.5487250, 98.6173930', 'Diabetes jangan banyak gula + kecap. Maksimal 3 sendok utk total gula dan kecap', '-', 0, 1, '2020-10-30 03:08:21'),
(66, 2, 1, 2, 23, 'Komplek mutiara palace blok DD-33A', '3.610491,98.711592', '-', '-', 0, 1, '2020-10-30 03:08:53'),
(67, 2, 1, 1, 24, 'asia mega mas blok H no.1', '3.585245,98.703028', 'Lanjut hari selasa tanya lagi', '-', 0, 1, '2020-10-30 03:09:30'),
(68, 2, 1, 2, 24, 'asia mega mas blok H no.1', '3.585245,98.703028', 'Lanjut hari selasa tanya lagi', '-', 0, 1, '2020-10-30 03:09:42'),
(69, 2, 1, 1, 25, 'Komplek villa gading mas 2 blok DD.17', '3.533581,98.697020', 'LESS SALT, LESS MACIG, totalnya 1/2 sendok teh', '-', 0, 1, '2020-10-30 03:11:05'),
(70, 2, 1, 2, 25, 'Komplek villa gading mas 2 blok DD.17', '3.533581,98.697020', 'LESS SALT, LESS MACIG, totalnya 1/2 sendok teh', '-', 0, 1, '2020-10-30 03:11:34'),
(71, 2, 1, 1, 26, 'Jl. Tembakau Deli No 2N (Masuk di sbelah jalan Graha Merah Putih)', '3.592226,98.674562', '-', '-', 0, 1, '2020-10-30 03:11:54'),
(72, 2, 1, 1, 27, 'jln harmonika baru no.110 pasar 1 padang bulan medan selayang 20135 ( depan J&M coffee). Menu: lunch + dinner weekely.', '3.555143,98.649645', 'Tanya kelanjutan selasa', '-', 0, 1, '2020-10-30 03:12:17'),
(73, 2, 1, 2, 27, 'jln harmonika baru no.110 pasar 1 padang bulan medan selayang 20135 ( depan J&M coffee). Menu: lunch + dinner weekely.', '3.555143,98.649645', 'Tanya kelanjutan selasa', '-', 0, 1, '2020-10-30 03:12:27'),
(74, 2, 1, 1, 28, 'Jl. Raden Saleh Dalam No. 10', '3.589318,98.677325', 'LESS SALT, LESS MACIG, totalnya 1/2 sendok teh', '-', 0, 1, '2020-10-30 03:12:49'),
(76, 2, 1, 1, 29, 'jl pasar 1 gg polonia no.88 (rumah putih ujung)', '3.558715,98.629152', '-', '-', 0, 1, '2020-10-30 03:13:26'),
(77, 2, 1, 2, 29, 'jl pasar 1 gg polonia no.88 (rumah putih ujung)', '3.558715,98.629152', '-', '-', 0, 1, '2020-10-30 03:13:42'),
(78, 2, 1, 1, 30, 'BCA Diponegoro', '3.584618,98.672817', 'No Beef', '-', 0, 1, '2020-10-30 03:13:59'),
(79, 2, 1, 2, 31, 'Oyo medan city homestay / turki family spa jln dr mansyur no 81', '3.567458,98.647036', 'Rabu pause. HARUS SAMPE KE TANGANNYA SEBELUM 17.30', '-', 0, 1, '2020-10-30 03:14:35'),
(80, 2, 2, 1, 32, 'BCA JW MARIOT', '3.596293,98.675918', '-', '-', 0, 1, '2020-10-31 01:36:51'),
(81, 2, 2, 2, 31, 'Oyo medan city homestay / turki family spa jln dr mansyur no 81', '3.567458,98.647036', 'Rabu pause. HARUS SAMPE KE TANGANNYA SEBELUM 17.30', '-', 0, 1, '2020-10-31 01:44:22'),
(82, 2, 2, 1, 30, 'BCA Diponegoro', '3.584618,98.672817', '-', '-', 0, 1, '2020-10-31 01:45:13'),
(83, 2, 2, 1, 29, 'jl pasar 1 gg polonia no.88 (rumah putih ujung)', '3.558715,98.629152', '-', '-', 0, 1, '2020-10-31 01:46:00'),
(84, 2, 2, 2, 29, 'jl pasar 1 gg polonia no.88 (rumah putih ujung)', '3.558715,98.629152', '-', '-', 0, 1, '2020-10-31 01:46:19'),
(85, 2, 2, 1, 28, 'Jl. Raden Saleh Dalam No. 10', '3.589318,98.677325', '-', '-', 0, 1, '2020-10-31 01:47:00'),
(86, 2, 2, 2, 28, 'Jl. Raden Saleh Dalam No. 10', '3.589318,98.677325', '-', '-', 0, 1, '2020-10-31 01:47:23'),
(87, 2, 2, 1, 26, 'Jl. Tembakau Deli No 2N (Masuk di sbelah jalan Graha Merah Putih)', '3.592226,98.674562', '-', '-', 0, 1, '2020-10-31 01:51:23'),
(88, 2, 2, 2, 23, 'Komplek mutiara palace blok DD-33A', '3.610491,98.711592', '-', '-', 0, 1, '2020-10-31 01:53:26'),
(89, 2, 2, 1, 21, 'Alamat Pengiriman:jl flamboyan raya,kompleks taman asoka asri blok E no 21', '3.5487250, 98.6173930', '-', '-', 0, 1, '2020-10-31 01:55:46'),
(90, 2, 2, 2, 21, 'Alamat Pengiriman:jl flamboyan raya,kompleks taman asoka asri blok E no 21', '3.5487250, 98.6173930', '-', '-', 0, 1, '2020-10-31 01:56:04'),
(91, 2, 2, 2, 20, '(Dinner) Jl. Puri Gg. K Alimun no 28/59B (masuk gang, mentok belok kiri)', '3.578560,98.688845', '-', '-', 0, 1, '2020-10-31 01:56:30'),
(92, 2, 2, 1, 19, '(LUNCH) BCA ASIA SIMPANG LAMPUNG (samping bank UOB) jl. Asia no 184D titip satpam', '3.584527,98.691058', 'LUNCH titip satpam. Dinner ke jl. Puri.', '-', 0, 1, '2020-10-31 01:56:47'),
(93, 2, 2, 1, 17, 'Jl. Karya Jaya No. 146', '3.5301298, 98.6776335', '-', '-', 0, 1, '2020-10-31 01:57:23'),
(94, 2, 2, 2, 17, 'Jl. Karya Jaya No. 146', '3.5301298, 98.6776335', '-', '-', 0, 1, '2020-10-31 01:57:38'),
(95, 2, 2, 1, 16, 'Jl. Emas no. 18/30, sei rengas II', '3.5847916, 98.6976904', '-', '-', 0, 1, '2020-10-31 01:58:28'),
(97, 2, 2, 2, 15, 'Jl.Bunga Ester No.64d Psr VI P.Bulan (rumahnya pas di depan gereja katolik St.Fransiskus)', '3.544960, 98.651088', '-', '-', 0, 1, '2020-10-31 01:59:12'),
(98, 2, 2, 1, 24, 'asia mega mas blok H no.1', '3.585245,98.703028', '-', '-', 0, 1, '2020-10-31 04:07:03'),
(99, 2, 2, 2, 24, 'asia mega mas blok H no.1', '3.585245,98.703028', '-', '-', 0, 1, '2020-10-31 04:07:26'),
(100, 2, 1, 2, 28, 'Jl. Raden Saleh Dalam No. 10', '3.589318,98.677325', '-', '-', 0, 1, '2020-10-31 04:10:25'),
(101, 2, 3, 1, 32, 'BCA JW MARIOT', '3.596293,98.675918', '-', '-', 0, 1, '2020-11-01 13:33:01'),
(102, 2, 3, 1, 30, 'BCA Diponegoro', '3.584618,98.672817', '-', '-', 0, 1, '2020-11-01 13:33:44'),
(103, 2, 3, 1, 29, 'jl pasar 1 gg polonia no.88 (rumah putih ujung)', '3.558715,98.629152', '-', '-', 0, 1, '2020-11-01 13:34:00'),
(104, 2, 3, 2, 29, 'jl pasar 1 gg polonia no.88 (rumah putih ujung)', '3.558715,98.629152', '-', '-', 0, 1, '2020-11-01 13:34:23'),
(105, 2, 3, 1, 28, 'Jl. Raden Saleh Dalam No. 10', '3.589318,98.677325', '-', '-', 0, 1, '2020-11-01 13:34:40'),
(106, 2, 3, 2, 28, 'Jl. Raden Saleh Dalam No. 10', '3.589318,98.677325', '-', '-', 0, 1, '2020-11-01 13:34:53'),
(107, 2, 3, 1, 26, 'Ke jln irian barat no A1', '3.587039,98.682708', '-', '-', 0, 1, '2020-11-01 13:35:36'),
(108, 2, 3, 1, 24, 'asia mega mas blok H no.1', '3.585245,98.703028', '-', '-', 0, 1, '2020-11-01 13:36:01'),
(109, 2, 3, 2, 24, 'asia mega mas blok H no.1', '3.585245,98.703028', '-', '-', 0, 1, '2020-11-01 13:36:14'),
(110, 2, 3, 2, 23, 'Komplek mutiara palace blok DD-33A', '3.610491,98.711592', '-', '-', 0, 1, '2020-11-01 13:36:37'),
(111, 2, 3, 1, 21, 'Alamat Pengiriman:jl flamboyan raya,kompleks taman asoka asri blok E no 21', '3.5487250, 98.6173930', '-', '-', 0, 1, '2020-11-01 13:37:42'),
(112, 2, 3, 2, 21, 'Alamat Pengiriman:jl flamboyan raya,kompleks taman asoka asri blok E no 21', '3.5487250, 98.6173930', '-', '-', 0, 1, '2020-11-01 13:37:52'),
(113, 2, 3, 2, 20, '(Dinner) Jl. Puri Gg. K Alimun no 28/59B (masuk gang, mentok belok kiri)', '3.578560,98.688845', '-', '-', 0, 1, '2020-11-01 13:38:21'),
(114, 2, 3, 1, 19, '(LUNCH) BCA ASIA SIMPANG LAMPUNG (samping bank UOB) jl. Asia no 184D titip satpam', '3.584527,98.691058', 'LUNCH titip satpam. Harus sampe sebelum 11.45 !!', '-', 0, 1, '2020-11-01 13:38:42'),
(115, 2, 3, 1, 17, 'Jl. Karya Jaya No. 146', '3.5301298, 98.6776335', '-', '-', 0, 1, '2020-11-01 13:39:30'),
(116, 2, 3, 2, 17, 'Jl. Karya Jaya No. 146', '3.5301298, 98.6776335', '-', '-', 0, 1, '2020-11-01 13:39:42'),
(117, 2, 3, 1, 16, 'Jl. Emas no. 18/30, sei rengas II', '3.5847916, 98.6976904', '-', '-', 0, 1, '2020-11-01 13:39:57'),
(118, 2, 3, 1, 15, 'Jl.Bunga Ester No.64d Psr VI P.Bulan (rumahnya pas di depan gereja katolik St.Fransiskus)', '3.544960, 98.651088', 'Ada MAAGH harus sampe sebelum jam 6', '-', 0, 1, '2020-11-01 13:40:56'),
(119, 2, 3, 2, 15, 'Jl.Bunga Ester No.64d Psr VI P.Bulan (rumahnya pas di depan gereja katolik St.Fransiskus)', '3.544960, 98.651088', 'Ada MAAGH sebelum jam 6', '-', 0, 1, '2020-11-01 13:41:19'),
(120, 2, 4, 1, 33, 'Jl. Kenanga sari No. 21 Pasar 6 Tj. Sari3', '3.561760,98.639896', '-', '-', 0, 1, '2020-11-02 08:07:49'),
(121, 2, 4, 1, 32, 'BCA JW MARIOT', '3.596293,98.675918', '-', '-', 0, 1, '2020-11-02 08:09:26'),
(123, 2, 4, 2, 31, 'Oyo medan city homestay / turki family spa jln dr mansyur no 81', '3.567458,98.647036', 'Rabu pause. HARUS SAMPE KE TANGANNYA SEBELUM 17.30', '-', 0, 1, '2020-11-02 08:10:59'),
(124, 2, 4, 1, 30, 'BCA Diponegoro', '3.584618,98.672817', '-', '-', 0, 1, '2020-11-02 08:11:34'),
(125, 2, 4, 1, 29, 'jl pasar 1 gg polonia no.88 (rumah putih ujung)', '3.558715,98.629152', '-', '-', 0, 1, '2020-11-02 08:12:22'),
(126, 2, 4, 2, 29, 'jl pasar 1 gg polonia no.88 (rumah putih ujung)', '3.558715,98.629152', '-', '-', 0, 1, '2020-11-02 08:12:42'),
(127, 2, 4, 1, 28, 'Jl. Raden Saleh Dalam No. 10', '3.589318,98.677325', '-', '-', 0, 1, '2020-11-02 08:14:08'),
(128, 2, 4, 2, 28, 'Jl. Raden Saleh Dalam No. 10', '3.589318,98.677325', '-', '-', 0, 1, '2020-11-02 08:14:24'),
(129, 2, 4, 1, 26, 'Jl. Tembakau Deli No 2N (Masuk di sbelah jalan Graha Merah Putih)', '3.592226,98.674562', '-', '-', 0, 1, '2020-11-02 08:15:22'),
(130, 2, 4, 1, 24, 'asia mega mas blok H no.1', '3.585245,98.703028', '-', '-', 0, 1, '2020-11-02 08:16:56'),
(131, 2, 4, 2, 24, 'asia mega mas blok H no.1', '3.585245,98.703028', '-', '-', 0, 1, '2020-11-02 08:17:26'),
(132, 2, 4, 2, 23, 'Komplek mutiara palace blok DD-33A', '3.610491,98.711592', '-', '-', 0, 1, '2020-11-02 08:18:01'),
(133, 2, 4, 1, 21, 'Alamat Pengiriman:jl flamboyan raya,kompleks taman asoka asri blok E no 21', '3.5487250, 98.6173930', '-', '-', 0, 1, '2020-11-02 08:18:49'),
(134, 2, 4, 2, 21, 'Alamat Pengiriman:jl flamboyan raya,kompleks taman asoka asri blok E no 21', '3.5487250, 98.6173930', '-', '-', 0, 1, '2020-11-02 08:19:25'),
(135, 2, 4, 2, 20, '(Dinner) Jl. Puri Gg. K Alimun no 28/59B (masuk gang, mentok belok kiri)', '3.578560,98.688845', '-', '-', 0, 1, '2020-11-02 08:20:16'),
(136, 2, 4, 1, 19, '(LUNCH) BCA ASIA SIMPANG LAMPUNG (samping bank UOB) jl. Asia no 184D titip satpam', '3.584527,98.691058', 'LUNCH titip satpam. Harus sampe sebelum 11.45 !!', '-', 0, 1, '2020-11-02 08:20:32'),
(137, 2, 4, 1, 17, 'Jl. Karya Jaya No. 146', '3.529349,98.676531', '-', '-', 0, 1, '2020-11-02 08:20:53'),
(138, 2, 4, 2, 17, 'Jl. Karya Jaya No. 146', '3.529349,98.676531', '-', '-', 0, 1, '2020-11-02 08:21:11'),
(139, 2, 4, 1, 16, 'Jl. Emas no. 18/30, sei rengas II', '3.5847916, 98.6976904', '-', '-', 0, 1, '2020-11-02 08:21:30'),
(140, 2, 4, 1, 14, 'Jl. Karya sehati no. 24', '3.530639, 98.671111', 'Start rabu batch 29', '-', 0, 1, '2020-11-02 08:22:22'),
(141, 2, 4, 1, 34, 'Total Fitcamp, Jl sei blutu No 101 Medan', '3.576048,98.645136', '-', '-', 0, 1, '2020-11-02 11:35:45'),
(142, 2, 4, 2, 35, 'Jl besar Tembung masuk Jl balai umum No 5 Tembung', '3.594485,98.747070', '-', '-', 0, 1, '2020-11-02 11:36:00'),
(144, 2, 4, 2, 14, 'Jl. Karya sehati no. 24', '3.530639, 98.671111', 'Start rabu batch 29', '-', 0, 1, '2020-11-03 04:20:54'),
(145, 2, 5, 1, 35, 'Jl besar Tembung masuk Jl balai umum No 5 Tembung', '3.594485,98.747070', '-', '-', 0, 1, '2020-11-03 23:51:42'),
(146, 2, 5, 2, 35, 'Jl besar Tembung masuk Jl balai umum No 5 Tembung', '3.594485,98.747070', '-', '-', 0, 1, '2020-11-03 23:52:18'),
(147, 2, 5, 1, 33, 'Jl. Kenanga sari No. 21 Pasar 6 Tj. Sari3', '3.561760,98.639896', '-', '-', 0, 1, '2020-11-03 23:53:18'),
(148, 2, 5, 1, 32, 'BCA JW MARIOT', '3.596293,98.675918', '-', '-', 0, 1, '2020-11-03 23:53:42'),
(149, 2, 5, 2, 31, 'Oyo medan city homestay / turki family spa jln dr mansyur no 81', '3.567458,98.647036', 'Rabu pause. HARUS SAMPE KE TANGANNYA SEBELUM 17.30', '-', 0, 1, '2020-11-03 23:54:17'),
(150, 2, 5, 1, 30, 'BCA Diponegoro', '3.584618,98.672817', '-', '-', 0, 1, '2020-11-03 23:54:51'),
(151, 2, 5, 1, 29, 'jl pasar 1 gg polonia no.88 (rumah putih ujung)', '3.558715,98.629152', '-', '-', 0, 1, '2020-11-03 23:55:15'),
(152, 2, 5, 2, 29, 'jl pasar 1 gg polonia no.88 (rumah putih ujung)', '3.558715,98.629152', '-', '-', 0, 1, '2020-11-03 23:55:31'),
(153, 2, 5, 1, 28, 'Jl. Raden Saleh Dalam No. 10', '3.589318,98.677325', '-', '-', 0, 1, '2020-11-03 23:55:46'),
(154, 2, 5, 2, 28, 'Jl. Raden Saleh Dalam No. 10', '3.589318,98.677325', '-', '-', 0, 1, '2020-11-03 23:55:57'),
(155, 2, 5, 1, 26, 'Jl. Tembakau Deli No 2N (Masuk di sbelah jalan Graha Merah Putih)', '3.592226,98.674562', '-', '-', 0, 1, '2020-11-03 23:56:18'),
(156, 2, 5, 1, 24, 'asia mega mas blok H no.1', '3.585245,98.703028', '-', '-', 0, 1, '2020-11-03 23:56:40'),
(157, 2, 5, 2, 24, 'asia mega mas blok H no.1', '3.585245,98.703028', '-', '-', 0, 1, '2020-11-03 23:56:56'),
(158, 2, 5, 2, 23, 'Komplek mutiara palace blok DD-33A', '3.610491,98.711592', '-', '-', 0, 1, '2020-11-03 23:57:15'),
(159, 2, 5, 1, 21, 'Alamat Pengiriman:jl flamboyan raya,kompleks taman asoka asri blok E no 21', '3.5487250, 98.6173930', '-', '-', 0, 1, '2020-11-03 23:57:33'),
(160, 2, 5, 2, 21, 'Alamat Pengiriman:jl flamboyan raya,kompleks taman asoka asri blok E no 21', '3.5487250, 98.6173930', '-', '-', 0, 1, '2020-11-03 23:57:48'),
(161, 2, 5, 1, 19, '(LUNCH) BCA ASIA SIMPANG LAMPUNG (samping bank UOB) jl. Asia no 184D titip satpam', '3.584527,98.691058', 'LUNCH titip satpam. Harus sampe sebelum 11.45 !!', '-', 0, 1, '2020-11-03 23:58:05'),
(162, 2, 5, 2, 20, '(Dinner) Jl. Puri Gg. K Alimun no 28/59B (masuk gang, mentok belok kiri)', '3.578560,98.688845', '-', '-', 0, 1, '2020-11-03 23:58:20'),
(163, 2, 5, 1, 17, 'Jl. Karya Jaya No. 146', '3.529349,98.676531', '-', '-', 0, 1, '2020-11-03 23:58:38'),
(164, 2, 5, 2, 17, 'Jl. Karya Jaya No. 146', '3.529349,98.676531', '-', '-', 0, 1, '2020-11-03 23:58:50'),
(165, 2, 5, 1, 16, 'Jl. Emas no. 18/30, sei rengas II', '3.5847916, 98.6976904', '-', '-', 0, 1, '2020-11-03 23:59:05'),
(166, 2, 5, 1, 15, 'Jl.Bunga Ester No.64d Psr VI P.Bulan (rumahnya pas di depan gereja katolik St.Fransiskus)', '3.544960, 98.651088', 'Ada MAAGH sebelum jam 6 Dinner', '-', 0, 1, '2020-11-03 23:59:35'),
(167, 2, 5, 2, 15, 'Jl.Bunga Ester No.64d Psr VI P.Bulan (rumahnya pas di depan gereja katolik St.Fransiskus)', '3.544960, 98.651088', 'Ada MAAGH sebelum jam 6 Dinner', '-', 0, 1, '2020-11-03 23:59:50'),
(168, 2, 5, 2, 14, 'Jl. Karya sehati no. 24', '3.530639, 98.671111', '', '-', 0, 1, '2020-11-04 00:00:12'),
(170, 3, 1, 2, 52, 'Jl.M. Idris no 47', '3.596292,98.659113', 'Dinner sebelum jam 6. Intermitten fasting', '-', 0, 1, '2020-11-07 19:45:43'),
(171, 3, 1, 2, 51, 'Jl. Karya sehati no. 24. ', '3.530639, 98.671111', '', '-', 0, 1, '2020-11-07 19:45:59'),
(172, 3, 1, 1, 50, 'Jl.Bunga Ester No.64d Psr VI P.Bulan (rumahnya pas di depan gereja katolik St.Fransiskus). ', '3.544960, 98.651088', 'Ada MAAGH sebelum jam 6 Dinner', '-', 0, 1, '2020-11-07 19:46:13'),
(173, 3, 1, 2, 50, 'Jl.Bunga Ester No.64d Psr VI P.Bulan (rumahnya pas di depan gereja katolik St.Fransiskus). ', '3.544960, 98.651088', 'Ada MAAGH sebelum jam 6 Dinner', '-', 0, 1, '2020-11-07 19:46:22'),
